records,locations,id
1,"Kumamoto Prefectural Fisheries Res Ctr, Kumamoto, Japan",2093
1,"Kumamoto Prefectural Inst Publ Hlth & Environm Sc, Udo, Japan",2094
11,"Kumamoto Univ, Kumamoto, Japan",2095
1,"KUMST, Khozestan, Iran",2096
2,"Kung Krabaen Bay Fisheries Res & Dev Study Ctr, Chantaburi, Thailand",2097
2,"Kunming Univ Sci & Technol, Kunming, Peoples R China",2098
1,"Kunsan Natl Univ, Jeollabuk Do, South Korea",2099
1,"Kupang State Agr Polytech Politani Kupang East Nu, Penfui Kupang East Nusa, Indonesia",2100
1,"Kuroshio Biol Res Fdn, Kochi, Japan",2101
1,"KUSTEM, Kuala Terengganu, Malaysia",2102
1,"Kuwait Inst Sci Res, Salmiya, Kuwait",2103
1,"Kuwait Univ, Safat, Kuwait",2104
1,"Kyoritsu Univ Pharm, Tokyo, Japan",2105
1,"Kyoto Gakuen Univ, Kyoto, Japan",2106
2,"Kyoto Inst Technol, Kyoto, Japan",2107
1,"Kyoto Pharmaceut Univ, Kyoto, Japan",2108
1,"Kyoto Univ Museum, Kyoto, Japan",2109
42,"Kyoto Univ, Kyoto, Japan",2110
2,"Kyoto Univ, Shiga, Japan",2111
1,"Kyoto Univ, Shirayama, Japan",2112
2,"Kyoto Univ, Wakayama, Japan",2113
1,"Kyowa Concrete Ind, Hokkaido, Japan",2114
1,"Kyung Hee Univ, Gyeonggi Do, South Korea",2115
1,"Kyungpook Natl Univ, Daegu, South Korea",2116
1,"Kyungpook Natl Univ, Taegu, South Korea",2117
1,"Kyushu Inst Technol, Fukuoka, Japan",2118
1,"Kyushu Tokai Univ, Kumamoto, Japan",2119
27,"Kyushu Univ, Fukuoka, Japan",2120
2,"Kyushu Univ, Kumamoto, Japan",2121
1,"La Mirada, Iloilo, Philippines",2122
1,"La Plata Natl Univ, Buenos Aires, Argentina",2123
4,"La Trobe Univ, Vic, Australia",2124
1,"Lab Aquaculture & Artemia Reference Ctr, Ghent, Belgium",2125
1,"Lab Aquaculture, Ghent, Belgium",2126
1,"Lab Aquat Ecol & Evolutionary Biol, Louvain, Belgium",2127
1,"Lab Crustacean Res, Lafayette, LA USA",2128
1,"Lab Dept Vet Herault, Montpellier, France",2129
1,"Lab Excellence Corail, Perpignan, France",2130
1,"Lab Mol Biostruct & Nanomat Modeling, Trieste, Italy",2131
1,"Lab Pharmaceut Microbiol, Ghent, Belgium",2132
1,"Lab Sci Climat & Environm, Gif Sur Yvette, France",2133
1,"Lab Symbioses Trop & Med Campus Int Baillarguet, Montpellier, France",2134
2,"LabEx Corail, Noumea, New Caledonia",2135
1,"Lagos State Univ, Lagos, Nigeria",2136
1,"Laguna Lake Dev Author, Quezon City, Philippines",2137
3,"Lake Biwa Museum, Shiga, Japan",2138
1,"Lam Pam Dolphin Conservat Grp, Phattulung, Thailand",2139
1,"Lam Pam Fisheries Stn, Phattulung, Thailand",2140
1,"Lambung Mangkurat Univ, South Kalimantan, Indonesia",2141
1,"Lampung Univ, Bandar Lampung, Indonesia",2142
2,"Landcare Res, Auckland, New Zealand",2143
1,"Large Marine Vertebrates Project Philippines, Rome, Italy",2144
2,"Large Marine Vertebrates Res Inst Philippines, Bohol, Philippines",2145
3,"Las Muros, Ariege, France",2146
1,"LAVES, Oldenburg, Germany",2147
1,"Le Ros Subdiv, Batangas, Philippines",2148
1,"LEGATO Off, Banaue Ifugao, Philippines",2149
1,"LEHRSTUHL PHARMAZEUT BIOL, WURZBURG, GERMANY",2150
1,"Leibniz Ctr Trop Marine Ecol ZMT GmbH, Bremen, Germany",2151
8,"Leibniz Ctr Trop Marine Ecol ZMT, Bremen, Germany",2152
8,"Leibniz Ctr Trop Marine Ecol, Bremen, Germany",2153
1,"Leibniz Inst Evolut & Biodivers Sci, Berlin, Germany",2154
1,"Leibniz Inst Evolut & Biodiversitatsforsch, Berlin, Germany",2155
1,"Leibniz Inst Freshwater Ecol & Inland Fisheries I, Berlin, Germany",2156
3,"Leibniz Inst Freshwater Ecol & Inland Fisheries, Berlin, Germany",2157
1,"Leibniz Inst Marine Sci IFM GEOMAR, Kiel, Germany",2158
2,"Leibniz Inst Marine Sci, Kiel, Germany",2159
3,"Leibniz Inst Nat Prod Res & Infect Biol, Jena, Germany",2160
2,"Leibniz Inst Nat Product Res & Infect Biol, Jena, Germany",2161
1,"Leibniz Inst Zoo & Wild life Res, Berlin, Germany",2162
2,"Leibniz Inst Zoo & Wildlife Res, Berlin, Germany",2163
7,"Leiden Univ, Leiden, Netherlands",2164
1,"Leonard Wood Mem Ctr, Cebu, Philippines",2165
1,"Letterkenny Inst Technol, Co Donegal, Ireland",2166
1,"Letterkenny Inst Technol, Donegal, Ireland",2167
1,"Lewis Environm Serv Inc, Salt Springs, FL USA",2168
1,"Liaoning Normal Univ, Dalian, Peoples R China",2169
1,"Liberian Inst Biomed Res, Charlesville, Liberia",2170
1,"LifeCell Corp, Branchburg, NJ USA",2171
1,"Likas, Sabah, Malaysia",2172
1,"LIMAT B Univ Europeenne Bretagne, Vannes, France",2173
1,"Lincoln Marine Sci Ctr, SA, Australia",2174
1,"LINGKUNGAN HIDUP, JAKARTA, INDONESIA",2175
1,"Linkoping Univ, Linkoping, Sweden",2176
1,"Linnaeus Univ, Kalmar, Sweden",2177
2,"LIPI, Ambon, Indonesia",2178
1,"LIPI, Bogor, Indonesia",2179
2,"LIPI, Cibinong, Indonesia",2180
2,"LIPI, Jakarta, Indonesia",2181
2,"Liverpool John Moores Univ, Merseyside, England",2182
1,"Living Aquat Resources Res Ctr, Viangchan, Laos",2183
1,"London Ctr Neglected Trop Dis Res, London, England",2184
2,"London Sch Hyg & Trop Med, London WC1, England",2185
1,"London Sch Hyg & Trop Med, London, England",2186
1,"LONDON SCH HYG & TROP MED, MUHEZA, TANZANIA",2187
1,"Lonza Ltd, Basel, Switzerland",2188
1,"Los Alamos Natl Lab, Los Alamos, NM USA",2189
1,"Los Angeles Cty Museum Nat Hist, Los Angeles, CA USA",2190
1,"Los Angeles Cty, Los Angeles, CA USA",2191
1,"Los Lunas Silvery Minnow Refugium, Los Lunas, NM USA",2192
1,"Louisiana Dept Wildlife & Fisheries, Grand Isle, LA USA",2193
7,"Louisiana State Univ, Baton Rouge, LA USA",2194
1,"Louisiana State, Baton Rouge, LA USA",2195
1,"Louisiana Univ Marine Consortium, Chauvin, LA USA",2196
1,"Loyola Coll, Tamil Nadu, India",2197
1,"Loyola Univ, Chicago, IL USA",2198
1,"LRPTBPAT, Subang, Indonesia",2199
1,"Ludong Univ, Yantai, Peoples R China",2200
3,"Lund Univ, Lund, Sweden",2201
1,"LutrAtlantica, Locquenole, France",2202
1,"M Tuttle & Associates, Georgetown, ME USA",2203
2,"Ma Chung Univ, Malang, Indonesia",2204
1,"Macquarie Univ, NSW, Australia",2205
2,"Madawalabu Univ, Bale Robe, Ethiopia",2206
1,"Madras Vet Coll, Chennai, India",2207
1,"Madrid Inst Adv Studies, Canto Blanco, Spain",2208
4,"Madurai Kamaraj Univ, Tamil Nadu, India",2209
1,"Mae Fah Laung Univ, Chiang Rai, Thailand",2210
29,"Mae Fah Luang Univ, Chiang Rai, Thailand",2211
1,"Mae Fah LuangUnivers, Chiang Rai, Thailand",2212
1,"Maejo Univ, Chiang Mai Prov, Thailand",2213
11,"Maejo Univ, Chiang Mai, Thailand",2214
3,"Maejo Univ, Chiangmai, Thailand",2215
1,"Maha Sarakram Univ, Maha Sarakram, Thailand",2216
6,"Mahanakorn Univ Technol, Bangkok, Thailand",2217
1,"Mahanakorn Univ, Bangkok, Thailand",2218
1,"Mahasarakh Univ, Maha Sarakham, Thailand",2219
2,"Mahasarakham Rajabhat Univ, Mahasarakham, Thailand",2220
22,"Mahasarakham Univ, Maha Sarakham, Thailand",2221
4,"Mahasarakham Univ, Mahasarakham, Thailand",2222
1,"Mahasarakham Univ, Mahosarakham, Thailand",2223
1,"Mahasarakham Univ, Muang, Thailand",2224
1,"Mahido Univ, Bangkok, Thailand",2225
1,"Mahidol Univ Salaya, Nakhornpatom, Thailand",2226
393,"Mahidol Univ, Bangkok, Thailand",2227
7,"Mahidol Univ, Kanchanaburi, Thailand",2228
1,"Mahidol Univ, Nakhom Pathom, Thailand",2229
63,"Mahidol Univ, Nakhon Pathom, Thailand",2230
1,"Mahidol Univ, Nakhon Pathorn, Thailand",2231
3,"Mahidol Univ, Nakhonpathom, Thailand",2232
24,"Mahidol Univ, Nakhonsawan, Thailand",2233
1,"Mahidol Univ, Nakon Phatom, Thailand",2234
4,"Mahidol Univ, Nakorn Pathom, Thailand",2235
4,"Mahidol Univ, Nakornpathom, Thailand",2236
4,"Mahidol Univ, Nakornpatom, Thailand",2237
1,"Mahidol Univ, Nakorpatom, Thailand",2238
1,"Mahidol Univ, Pathumthani, Thailand",2239
1,"Mahidol Univ, Rachadhavi Bangkok, Thailand",2240
3,"Mahidol Univ, Salaya, Thailand",2241
2,"Mahsa Coll, Kuala Lumpur, Malaysia",2242
1,"MAHSA Univ, Kuala Lumpur, Malaysia",2243
1,"Main Ctr Brackishwater Aquacplture, Central Java, Indonesia",2244
1,"Main Off Educ & Teaching Area, Tehran, Iran",2245
1,"MAINE DEPT MARINE RES, BOOTHBAY HARBOR, ME USA",2246
1,"Maine Dept Marine Resources, W Boothbay Harbor, ME USA",2247
1,"Maine Maritime Acad, Castine, ME USA",2248
1,"Malaria Ctr, Luang Prabang P, Laos",2249
1,"Malaria Ctr, Luang Prabang, Laos",2250
2,"Malaria Ctr, Luangprabang, Laos",2251
1,"Malaria Reference Ctr, Singapore, Singapore",2252
1,"Malayer Univ, Malayer, Iran",2253
1,"Malaysia Agr Res & Dev Inst, Selangor DE, Malaysia",2254
1,"Malaysia Genome Inst, Selangor, Malaysia",2255
1,"Malaysia Palm Oil Board, Selangor, Malaysia",2256
1,"Malaysian Agr & Dev Inst, Kuala Lumpur, Malaysia",2257
2,"Malaysian Agr Res & Dev Inst, Kuala Lumpur, Malaysia",2258
1,"Malaysian Fishery Dev Board, Kuala Lumpur, Malaysia",2259
1,"Malaysian Inst Nucl Technol Res, Selangor, Malaysia",2260
1,"Malaysian Inst Pharmaceut & Nutraceut, Penang, Malaysia",2261
2,"Malaysian Palm Oil Board, Kuala Lumpur, Malaysia",2262
6,"Malaysian Palm Oil Board, Selangor, Malaysia",2263
1,"Malmo Univ Hosp, Malmo, Sweden",2264
3,"Manaaki Whenua Landcare Res, Auckland, New Zealand",2265
1,"Manchester Metropolitan Univ, Lancs, England",2266
1,"Mangalore Univ, Mangalagangothri, India",2267
1,"Manipur Univ, Manipur, India",2268
1,"Manta Marine Pvt Ltd, Male, Maldives",2269
2,"Manta Trust, Dorset, England",2270
1,"Mapua Inst Technol, Manila, Philippines",2271
1,"MARDI Headquarters, Selangor, Malaysia",2272
1,"MARDI Kuala Kangsar Res Stn, Perak, Malaysia",2273
1,"MARDI, Kuala Lumpur, Malaysia",2274
1,"MareCet Res Org, Shah Alam, Malaysia",2275
3,"Mariano Marcos State Univ, Ilocos Norte, Philippines",2276
1,"Marien Ngouabi Univ, Brazzaville, Congo",2277
1,"Marine & Coastal Resources Res Ctr, Samut Sakhon, Thailand",2278
1,"Marine & Freshwater Resources Inst, Queenscliff, Australia",2279
2,"Marine Biol Assoc UK, Devon, England",2280
4,"Marine Biol Assoc United Kingdom Lab, Devon, England",2281
1,"Marine Biol Lab, Woods Hole, MA USA",2282
1,"Marine Biol Res Ctr, Phuket, Thailand",2283
2,"Marine Biotechnol Inst, Iwate, Japan",2284
1,"MARINE BIOTECHNOL INST, TOKYO, JAPAN",2285
1,"Marine Conservat Soc, Hereford, England",2286
1,"Marine Ecol Inst Inc, Osaka, Japan",2287
1,"Marine Ecol Res Inst, Chiba, Japan",2288
1,"Marine Ecol, Heiligenhafen, Germany",2289
2,"Marine Finfish Prod & Res Ctr, Terengganu, Malaysia",2290
1,"Marine Fisheries Res & Dev Bur, Bangkok, Thailand",2291
1,"Marine Geol Inst ESDM, Bandung, Indonesia",2292
2,"Marine Geol Inst, Bandung, Indonesia",2293
1,"Marine Inst, Galway, Ireland",2294
2,"Marine Learning Ctr, Okinawa, Japan",2295
1,"Marine Megafauna Fdn, Truckee, CA USA",2296
1,"Marine Res Ctr, Male, Maldives",2297
1,"Marine Res Fdn, Kota Kinabalu, Malaysia",2298
3,"Marine Res Fdn, Sabah, Malaysia",2299
3,"Marine Res Inst, Reykjavik, Iceland",2300
1,"Marine Resources Res Inst, Charleston, SC USA",2301
2,"Marine Sci Stn, Aqaba, Jordan",2302
1,"Marine Scotland Sci, Aberdeen AB11 9DB, Scotland",2303
1,"Marine Shrimp Res & Dev Ctr, Songkhla, Thailand",2304
1,"Maritime & Port Author Singapore, Singapore, Singapore",2305
1,"Maryland Dept Nat Resources, Oxford, MD USA",2306
2,"Masaryk Univ, Brno, Czech Republic",2307
2,"Masdar Inst Sci & Technol, Abu Dhabi, U Arab Emirates",2308
1,"Masdar Inst, Abu Dhabi, U Arab Emirates",2309
1,"Maseo Maritimo, La Coruna, Spain",2310
1,"Massachusetts Gen Hosp, Boston, MA USA",2311
1,"Massey Univ, Palmerston North, New Zealand",2312
1,"Mataram Univ, Mataram, Indonesia",2313
1,"Matias H Aznar Mem Coll, Cebu, Philippines",2314
1,"Matis, Hofn, Iceland",2315
1,"Matis, Reykjavik, Iceland",2316
1,"Mauritius Oceanog Inst, Quatre Bornes, Mauritius",2317
1,"Mauritius Sugar Ind Res Inst, Reduit, Mauritius",2318
1,"Max Planck Inst Brain Res, Frankfurt, Germany",2319
1,"Max Planck Inst Colloids & Interfaces, Potsdam, Germany",2320
1,"Max Planck Inst Dev Biol, Tubingen, Germany",2321
1,"Max Planck Inst Evolutionary Biol, Plon, Germany",2322
1,"Max Planck Inst Expt Med, Gottingen, Germany",2323
1,"Max Planck Inst Infect Biol, Berlin, Germany",2324
1,"Max Planck Inst Mikrostrukturphys, Halle, Germany",2325
2,"Max Planck Inst Mol Physiol, Dortmund, Germany",2326
3,"Max Planck Inst Ornithol, Radolfzell am Bodensee, Germany",2327
1,"Mazandaran Univ Med Sci, Sari, Iran",2328
11,"McGill Univ, Montreal PQ, Canada",2329
2,"McGill Univ, Ste Anne De Bellevue PQ, Canada",2330
5,"McMaster Univ, Hamilton ON, Canada",2331
2,"McNeese State Univ, Lake Charles, LA USA",2332
1,"Med Care Dev Int, Malabo, Equat Guinea",2333
1,"Med Care Dev Int, Silver Spring, MD USA",2334
1,"Med Entomol Res Div, Yangon, Myanmar",2335
1,"Med Univ S Carolina, Charleston, SC USA",2336
1,"Med Univ South Carolina, Charleston, SC USA",2337
2,"Meguro Parasitol Museum, Tokyo, Japan",2338
3,"Meiji Pharmaceut Univ, Tokyo, Japan",2339
1,"Meiji Seika Pharma, Tokyo, Japan",2340
1,"Meiji Univ, Kanagawa, Japan",2341
1,"Meijo Univ, Aichi, Japan",2342
1,"Meio Biot Environm Serv, Florianopolis SC, Brazil",2343
1,"Meio Univ, Okinawa, Japan",2344
1,"Mekong Dolphin Conservat Project, Kratie, Cambodia",2345
1,"Mem Sloan Kettering Canc Ctr, New York, NY USA",2346
4,"Mem Univ Newfoundland, St John NF, Canada",2347
1,"Mem Univ Newfoundland, St Johns NF, Canada",2348
1,"Mendel Univ Brno, Brno, Czech Republic",2349
1,"Menia Univ, Minia, Egypt",2350
1,"Menicon Co Ltd, Lyon, France",2351
1,"Menoufia Univ, Shibin Al Kawm, Egypt",2352
1,"MerLion Pharmaceut, Singapore, Singapore",2353
1,"Mermaid Sustainable Resources Seabait Ltd, Northd, England",2354
1,"METOCEAN Environm Inc, Shizuoka, Japan",2355
1,"MFRD, Tema, Ghana",2356
1,"MGI, Selangor, Malaysia",2357
1,"Michigan State Univ, E Lansing, MI USA",2358
1,"Microbial Drugs Helmholtz Ctr Infect Res, Braunschweig, Germany",2359
1,"Middle E Tech Univ, Mersin, Turkey",2360
1,"Midwestern Univ, Downers Grove, IL USA",2361
1,"Mie Prefecture Hlth & Environm Res Inst, Yokaichi, Japan",2362
35,"Mie Univ, Mie, Japan",2363
1,"Milan Polytech Univ, Milan, Italy",2364
1,"Millikin Univ, Decatur, IL USA",2365
1,"Mindanao State Univ Iligan Inst Technol, Iligan, Philippines",2366
1,"Mindanao State Univ Iligan, Iligan, Philippines",2367
1,"Mindanao State Univ Maguindanao, Maguindanao, Philippines",2368
4,"Mindanao State Univ Naawan, Misamis Orienta, Philippines",2369
2,"Mindanao State Univ Naawan, Misamis Oriental, Philippines",2370
1,"Mindanao State Univ Naawan, Naawan, Philippines",2371
1,"Mindanao State Univ Tawi Tawi, Tawi Tawi, Philippines",2372
2,"Mindanao State Univ, Gen Santos City, Philippines",2373
1,"Mindanao State Univ, General Santos City, Philippines",2374
4,"Mindanao State Univ, Iligan, Philippines",2375
1,"Mindanao State Univ, Naawan, Philippines",2376
1,"Mindanao State Univ, Tawi Tawi, Philippines",2377
1,"Mindandp State Univ, Iligan City, Philippines",2378
1,"Mineral & Geosci Dept Malaysia, Kuala Lumpur, Malaysia",2379
1,"Mines & Geosci Bur, Quezon City, Philippines",2380
1,"Ming Chuan Univ, Tao Yuan, Taiwan",2381
1,"Mingdao Univ, Chang Hua, Taiwan",2382
2,"Minh Hai Subinst Fisheries Res, Ca Mau Province, Vietnam",2383
1,"Minist Agr & Community Dev, Sarawak, Malaysia",2384
10,"Minist Agr & Cooperat, Bangkok, Thailand",2385
2,"Minist Agr & Cooperat, Prachaubkirikhun, Thailand",2386
1,"Minist Agr & Cooperat, Prachuabkhirikh, Thailand",2387
1,"Minist Agr & Fisheries Wealth, Muscat, Oman",2388
1,"Minist Agr & Fisheries, Male, Maldives",2389
1,"Minist Agr & Food Ind, Sarawak, Malaysia",2390
4,"Minist Agr & Forestry, Viangchan, Laos",2391
1,"Minist Agr & Rural Dev Viet Nam, Hanoi, Vietnam",2392
1,"Minist Agr & Rural Dev, Bac Ninh, Vietnam",2393
1,"Minist Agr & Rural Dev, Hanoi, Vietnam",2394
2,"Minist Agr Forestry & Fisheries, Ibaraki, Japan",2395
5,"Minist Agr Forestry & Fisheries, Phnom Penh, Cambodia",2396
1,"Minist Agr, Qingdao, Peoples R China",2397
1,"Minist Agr, Shaanxi, Peoples R China",2398
1,"Minist Agr, Thimpu, Bhutan",2399
1,"Minist Agr, Wuhan, Peoples R China",2400
2,"Minist Agr, Yangling, Peoples R China",2401
1,"Minist Agriculture & Cooperat, Bangkok, Thailand",2402
1,"Minist Ambiente Energia & Telecomunicac, Heredia, Costa Rica",2403
1,"Minist Coastal Resources & Environm, Bangkok, Thailand",2404
1,"Minist Educ AG BIO PERDO CHE, Bangkok, Thailand",2405
1,"Minist Educ, Bangkok, Thailand",2406
1,"Minist Educ, Phuket, Thailand",2407
1,"Minist Energy Green Technol & Water, Putrajaya, Malaysia",2408
1,"Minist Environm & Climat Affairs, Muscat, Oman",2409
1,"Minist Environm & Climate Affairs, Muscat, Oman",2410
1,"Minist Environm & Forest, Dhaka, Bangladesh",2411
1,"Minist Environm & Forestry, Bogor, Indonesia",2412
1,"Minist Environm, Doha, Qatar",2413
2,"Minist Environm, Phnom Penh, Cambodia",2414
1,"Minist Environm, State Of Qatar, Qatar",2415
1,"Minist Fisheries & Livestock, Dhaka, Bangladesh",2416
1,"Minist Fisheries & Marine Resources, Honiara, Solomon Islands",2417
1,"Minist Forestry Indonesia, Bali, Indonesia",2418
1,"Minist Forestry, West Java, Indonesia",2419
1,"Minist Hlth Cambodia, Phnom Penh, Cambodia",2420
2,"Minist Hlth Malaysia, Putrajaya, Malaysia",2421
1,"MINIST HLTH, AL AIN, U ARAB EMIRATES",2422
1,"Minist Hlth, Antananarivo, Madagascar",2423
4,"Minist Hlth, Hanoi, Vietnam",2424
3,"Minist Hlth, Honiara, Solomon Islands",2425
2,"Minist Hlth, Jakarta, Indonesia",2426
1,"Minist Hlth, Kathmandu, Nepal",2427
1,"Minist Hlth, Maputo, Mozambique",2428
1,"Minist Hlth, Ouagadougou, Burkina Faso",2429
2,"Minist Hlth, Phnom Penh, Cambodia",2430
3,"Minist Hlth, Singapore, Singapore",2431
7,"Minist Hlth, Viangchan, Laos",2432
1,"Minist Hlth, Vientiane Capital, Laos",2433
1,"Minist Ind Min & Energy, Phnom Penh, Cambodia",2434
3,"Minist Livestock & Fisheries, Yangon, Myanmar",2435
1,"Minist Marine & Fisheries, Bandar Lampung, Indonesia",2436
1,"Minist Marine Affair & Fisheries, Jakarta, Indonesia",2437
1,"Minist Marine Affairs & Fisheries, Jakarta Utara, Indonesia",2438
1,"Minist Marine Affairs & Fisheries, Jakarta, Indonesia",2439
1,"Minist Nat Resources & Environm, Bangkok, Thailand",2440
1,"Minist Nat Resources, Honiara, Solomon Islands",2441
5,"Minist Natl Dev, Singapore, Singapore",2442
1,"Minist Publ Hlth, Lao Pdr, Laos",2443
9,"Minist Publ Hlth, Nonthaburi, Thailand",2444
6,"Minist Publ Hlth, Viangchan, Laos",2445
1,"Minist Res Technol & Higher Educ, Cent Jakarta, Indonesia",2446
1,"Minist Rural & Reg Dev, Kuala Lumpur, Malaysia",2447
1,"Minist Sci & Technol, Pathum Thani, Thailand",2448
1,"Minist Sci & Technol, Surat Thani, Thailand",2449
1,"Minist Sci & Technol, Suratthani, Thailand",2450
1,"Minist Sci Res & Innovat, Yaounde, Cameroon",2451
3,"Minist Sci Technol & Environm, Bangkok, Thailand",2452
1,"Minist Sci Technol & Environm, Pathumtani, Thailand",2453
2,"Minist Sci Technol & Innovat, Selangor De, Malaysia",2454
1,"Minist Sci Technol & Innovat, Selangor, Malaysia",2455
1,"Misool Manta Project, Papua Barat, Indonesia",2456
1,"Mississippi State Univ, Mississippi State, MS USA",2457
1,"Mississippi State Univ, Starkville, MS USA",2458
4,"MIT, Cambridge, MA USA",2459
1,"Mitsubishi Kasei Inst Life Sci, Tokyo, Japan",2460
1,"MIVEGEC IRD CNRS UM1 UM2, Montpellier, France",2461
1,"MIVEGEC IRD CREC, Benin, Nigeria",2462
1,"MIVEGEC UMR IRD224 CNRS UM1 UM2, Montpellier, France",2463
1,"MIVEGEC, Montpellier, France",2464
1,"Miyagi Prefecture Fisheries Res & Dev Ctr, Miyagi, Japan",2465
1,"Miyazaki Prefectural Fisheries Expt Stn, Aoshima, Japan",2466
1,"Miyazaki Prefectural Fisheries Expt Stn, Miyazaki, Japan",2467
45,"Miyazaki Univ, Miyazaki, Japan",2468
1,"Mizoram Univ, Mizoram, India",2469
1,"Mnhn, Paris, France",2470
1,"MoHLW, Tokyo, Japan",2471
1,"Mokpo Natl Univ, Muan, South Korea",2472
1,"Mokweon Univ, Daejeon, South Korea",2473
4,"Mol Ecol Resources Editorial Off, Vancouver BC, Canada",2474
4,"Monash Univ Malaysia, Bandar Sunway, Malaysia",2475
1,"Monash Univ Malaysia, Selangor Darul, Malaysia",2476
16,"Monash Univ Malaysia, Selangor, Malaysia",2477
2,"Monash Univ, Bandar Sunway, Malaysia",2478
1,"Monash Univ, Pj, Malaysia",2479
1,"Monash Univ, Selangor Darul Ehsan, Malaysia",2480
5,"Monash Univ, Selangor Darul, Malaysia",2481
3,"Monash Univ, Selangor De, Malaysia",2482
8,"Monash Univ, Selangor, Malaysia",2483
10,"Monash Univ, Vic, Australia",2484
1,"Mongolian Acad Sci, Ulaanbaatar, Mongol Peo Rep",2485
1,"Monsanto Brasil Ltda, Sao Paulo, Brazil",2486
2,"Montana State Univ, Bozeman, MT USA",2487
1,"Montclair State Univ, Montclair, NJ USA",2488
5,"Monterey Bay Aquarium Res Inst, Moss Landing, CA USA",2489
2,"Montpellier SupAgro, Montferrier Sur Lez, France",2490
1,"Morinaga Milk Ind Co Ltd, Kanagawa, Japan",2491
8,"Moscow MV Lomonosov State Univ, Moscow, Russia",2492
7,"Mote Marine Lab, Sarasota, FL USA",2493
1,"Motianling Nat Reserve, Shaanxi, Peoples R China",2494
1,"MPOB, Selangor, Malaysia",2495
2,"MRC Labs, Fajara, Gambia",2496
1,"MS Swaminathan Res Fdn, Andhra Pradesh, India",2497
1,"MS Swaminathan Res Fdn, Tamil Nadu, India",2498
1,"MSD Anim Hlth Innovat Pte Ltd, Singapore, Singapore",2499
1,"MSU Iligan Inst Technol, Iligan, Philippines",2500
1,"MSU, Illigan City, Philippines",2501
2,"Mt Allison Univ, Sackville NB, Canada",2502
2,"Mt Holyoke Coll, S Hadley, MA USA",2503
1,"Mugla Sitki Kocman Univ, Mugla, Turkey",2504
1,"Mulawarman Univ Jl, Samarinda, Indonesia",2505
1,"Mulawarman Univ, Samarinda, Indonesia",2506
1,"Municipal Agriculturists Off, Camarines Norte, Philippines",2507
1,"Municipal Ctr Hyg Epidemiol & Microbiol, Pinar Del Rio, Cuba",2508
1,"Murdoch Univ, Perth WA, Australia",2509
24,"Murdoch Univ, WA, Australia",2510
1,"Musee Natl Hist Nat, Luxembourg, Luxembourg",2511
1,"Musee Royal Afr Cent, Tervuren, Belgium",2512
1,"Musee Royal Afrique Cent, Tervuren, Belgium",2513
1,"Museo Paleontol Muzquiz, Coahuila, Mexico",2514
1,"Museu Nacl Univ Fed Rio de Janeiro, Rio De Janeiro, Brazil",2515
3,"Museum & Art Gallery No Terr, NT, Australia",2516
3,"Museum & Art Gallery Northern Terr, Darwin NT, Australia",2517
4,"Museum & Art Gallery Northern Terr, NT, Australia",2518
1,"Museum Art Gallery No Terr, NT, Australia",2519
1,"Museum Beijing Forestry Univ, Beijing, Peoples R China",2520
2,"Museum Hist Nat, Geneva, Switzerland",2521
2,"Museum Hist Nat, La Rochelle, France",2522
1,"Museum Hist Nat, Vienna, Austria",2523
2,"Museum Nat & Environm Hist, Shizuoka, Japan",2524
5,"Museum Nat Sci, Tokyo, Japan",2525
1,"Museum Natl Hist Nat, Concarneau, France",2526
1,"Museum Natl Hist Nat, Dinard, France",2527
1,"Museum Natl Hist Nat, Leiden, Netherlands",2528
30,"Museum Natl Hist Nat, Paris, France",2529
2,"Museum New Zealand Te Papa Tongarewa, Wellington, New Zealand",2530
4,"Museum Trop Queensland, Qld, Australia",2531
1,"MUSEUM VIC, VIC, AUSTRALIA",2532
5,"Museum Victoria, Vic, Australia",2533
1,"Museum Zool Bogoriense, Bogor, Indonesia",2534
1,"Museums Victoria, Vic, Australia",2535
1,"Mushroom Res Fdn, Chiang Mai, Thailand",2536
1,"MUST, Selangor, Malaysia",2537
1,"Mutiara Bunda Hosp, South Kalimanta, Indonesia",2538
1,"Myanmar Dept Fisheries, Yangon, Myanmar",2539
1,"N Carolina State Lab Publ Hlth, Raleigh, NC USA",2540
2,"N Carolina State Museum Nat Sci, Raleigh, NC USA",2541
1,"N Carolina State Refugee Hlth Program, Raleigh, NC USA",2542
6,"N Carolina State Univ, Raleigh, NC USA",2543
1,"N Highland Coll, Caithness, Scotland",2544
1,"N Manchester Grp Hosp, Lancs, England",2545
1,"N Pacific Anadromous Fish Commiss, Vancouver BC, Canada",2546
3,"NACA, Bangkok, Thailand",2547
1,"Nagao Nat Environm Fdn, Tokyo, Japan",2548
1,"Nagarjuna Univ, Andhra Pradesh, India",2549
1,"Nagasaki Food Hyg Assoc, Nagoya, Japan",2550
1,"Nagasaki Ind Promot Fdn, Nagasaki, Japan",2551
54,"Nagasaki Univ, Nagasaki, Japan",2552
2,"Nagoya City Univ, Aichi, Japan",2553
5,"Nagoya Univ, Aichi, Japan",2554
1,"Nagoya Univ, Shanghai, Peoples R China",2555
1,"Najran Univ, Najran, Saudi Arabia",2556
1,"Nakhon Phanom Univ, Nakhon Phanom, Thailand",2557
1,"Nakhonratchasima Coll, Nakhon Ratchasima, Thailand",2558
1,"Nakhonratchsima Rajabhat Univ, Naimuang, Thailand",2559
1,"Nam Sai Farms Co Ltd Moo, Prachinburi, Thailand",2560
1,"Namur Univ, Namur, Belgium",2561
1,"Nanchang Univ, Jiangxi Prov, Peoples R China",2562
1,"Nanchang Univ, Jiangxi, Peoples R China",2563
3,"Nanjing Agr Univ, Nanjing, Peoples R China",2564
1,"Nanjing Agr Univ, Wuxi, Peoples R China",2565
1,"Nanjing Med Univ, Nanjing, Peoples R China",2566
3,"Nanjing Normal Univ, Jiangsu, Peoples R China",2567
1,"Nanjing Normal Univ, Nanjing, Peoples R China",2568
1,"Nanjing Univ, Jiangsu, Peoples R China",2569
1,"Nanjing Univ, Nanjing, Peoples R China",2570
1,"Nantong Univ, Jiangsu, Peoples R China",2571
1,"Nanyang Polytech, Singapore, Singapore",2572
1,"Nanyang Technol Univ, Nanyang, Singapore",2573
84,"Nanyang Technol Univ, Singapore, Singapore",2574
1,"Nanzan Univ, Aichi, Japan",2575
1,"NAPFRE, Kedah, Malaysia",2576
2,"Napier Univ, Midlothian, Scotland",2577
1,"Nara Inst Sci & Technol, Ikoma, Japan",2578
1,"Nara Womens Univ, Nara, Japan",2579
1,"Naresuan Univ Phitsanulok, Phitsanulok, Thailand",2580
1,"Naresuan Univ, Phayao, Thailand",2581
24,"Naresuan Univ, Phitsanulok, Thailand",2582
4,"NASDA, Pathum Thani, Thailand",2583
1,"NAST Philippines, Metro Manila, Philippines",2584
1,"Nasu Agri Co Ltd, Tokyo, Japan",2585
1,"Nat & Heritage Conservat Initiat, Kerala, India",2586
14,"Nat Biodivers Ctr, Leiden, Netherlands",2587
1,"Nat Conservat Fdn, Karnataka, India",2588
12,"Nat Hist Museum & Inst, Chiba, Japan",2589
1,"Nat Hist Museum Burgergemeinde Bern, Bern, Switzerland",2590
3,"Nat Hist Museum Denmark, Copenhagen O, Denmark",2591
1,"Nat Hist Museum Frankfurt, Frankfurt, Germany",2592
1,"Nat Hist Museum Los Angeles Cty, Los Angeles, CA USA",2593
2,"Nat Hist Museum Wien, Vienna, Austria",2594
2,"Nat Hist Museum, Frankfurt, Germany",2595
1,"NAT HIST MUSEUM, LONDON SW7 5BD, ENGLAND",2596
38,"Nat Hist Museum, London, England",2597
1,"Nat Hist Museum, Valdagno, Italy",2598
3,"Nat Hist Museum, Vienna, Austria",2599
1,"Nat Res Ltd, Aberdeen, Scotland",2600
1,"Nat Resources Conservat Off Papua Barat, Papua Barat Pro, Indonesia",2601
1,"Nat Resources Inst, Kent, England",2602
1,"Nat Soc Singapore NSS, Singapore, Singapore",2603
1,"Nat Soc Singapore, Singapore, Singapore",2604
1,"Natl Acad Agr Sci, Suwon, South Korea",2605
1,"Natl Acad Sci & Technol Philippines, Metro Manila, Philippines",2606
1,"Natl Acad Sci Belarus, Minsk, Byelarus",2607
1,"Natl Agr & Food Res Org, Ibaraki, Japan",2608
