records,locations,id
1,"So Illinois Univ, Edwardsville, IL USA",3616
1,"So Luzon State Univ, Quezon City, Philippines",3617
2,"So Med Univ, Guangdong, Peoples R China",3618
1,"SOA, Qingdao, Peoples R China",3619
1,"SOA, Xiamen, Peoples R China",3620
1,"Soc Francaise Etud & Protect Mammiferes, Paris, France",3621
2,"Soc Nat Romagna, Bagnacavallo RA, Italy",3622
1,"Soc Naturalist Romagna, Bagnacavallo RA, Italy",3623
2,"Soc Studi Nat Romagna, Bagnacavallo RA, Italy",3624
1,"Societa Naturalisticidella Romagna, Bagnacavallo RA, Italy",3625
1,"Societe Etudes Ornithol reunion, St Andre, Reunion",3626
1,"Soegijapranata Catholic Univ, Semarang, Indonesia",3627
3,"Sohag Univ, Sohag, Egypt",3628
1,"Soil & Fertilizer Res Inst, Hanoi, Vietnam",3629
8,"Soka Univ, Tokyo, Japan",3630
1,"SOKENDAI, Tokyo, Japan",3631
1,"Sokoine Univ Agr, Morogoro, Tanzania",3632
1,"Songkhla Rajabhat Univ, Songkhla, Thailand",3633
1,"SONGKLA COASTAL AQUACULTURE DEV CTR, SONGKHLA, THAILAND",3634
1,"Songkla Univ, Songkhla, Thailand",3635
1,"Soochow Univ, Suzhou, Peoples R China",3636
4,"Soochow Univ, Taipei, Taiwan",3637
2,"Soonchunhyang Univ, Asan, South Korea",3638
1,"Sorbonne Univ, Paris, France",3639
1,"South African Inst Aquat Biodivers SAIAB, Grahamstown, South Africa",3640
5,"South African Inst Aquat Biodivers, Grahamstown, South Africa",3641
1,"South Australian Museum, Adelaide SA, Australia",3642
10,"South China Agr Univ, Guangdong, Peoples R China",3643
1,"South Valley Univ, Qena, Egypt",3644
2,"Southeast Asian Fisheries Dev Ctr SEAFDEC AQD, Iloilo, Philippines",3645
1,"Southeast Asian Fisheries Dev Ctr SEAFDEC, Iloilo, Philippines",3646
9,"Southeast Asian Fisheries Dev Ctr, Iloilo, Philippines",3647
3,"Southeast Asian Fisheries Dev Ctr, Rizal, Philippines",3648
2,"Southern Cross Univ, NSW, Australia",3649
2,"Southern Fed Univ, Rostov Na Donu, Russia",3650
2,"Southern Fed Univ, Rostov Region, Russia",3651
1,"Southern Leyte State Univ, Sogod, Philippines",3652
1,"Southern Leyte State Univ, Southern Leyte, Philippines",3653
1,"Southern Marine Fisheries Res & Dev Ctr Songkhla, Songkhla, Thailand",3654
2,"Southern Monitoring Ctr Aquaculture Environm & Ep, Ho Chi Minh City, Vietnam",3655
1,"Southern Philippines Med Ctr, Davao, Philippines",3656
1,"Southern Reg Plant Protect Ctr, Long Dinh, Vietnam",3657
1,"Southwest Univ, Chongqing, Peoples R China",3658
1,"SpaceFish LLP, Hokkaido, Japan",3659
1,"Sri Bhagawan Mahaveer Jain Coll, Karnataka, India",3660
82,"Srinakharinwirot Univ, Bangkok, Thailand",3661
1,"Srinakharinwirot Univ, Bkk, Thailand",3662
2,"Srinakharinwirot Univ, Nakhon Nayok, Thailand",3663
1,"Srinakharinwirote Univ, Bangkok, Thailand",3664
1,"Sripratoom Univ, Bangkok, Thailand",3665
1,"Sriwijaya Univ, Palembang, Indonesia",3666
1,"Sriwijaya Univ, South Sumatera, Indonesia",3667
3,"SRM Arts & Sci Coll, Tamil Nadu, India",3668
12,"SRM Univ, Tamil Nadu, India",3669
1,"SRP Neurosci & Behav Disorders, Singapore, Singapore",3670
1,"SRUC, Midlothian, Scotland",3671
1,"SSA, Jalisco, Mexico",3672
1,"St Elizabeth Hosp, Tilburg, Netherlands",3673
2,"St Georges Univ, St Georges, Grenada",3674
1,"St Georges Univ, The Lime, Grenada",3675
1,"St Louis Univ, St Louis, MO USA",3676
1,"St Marys Jr Coll, Fukuoka, Japan",3677
2,"St Paul Univ, Quezon City, Philippines",3678
1,"St Peters Univ Hosp, New Brunswick, NJ USA",3679
1,"St Xavier Coll Autonomous, Tamil Nadu, India",3680
10,"St Xaviers Coll Autonomous, Tamil Nadu, India",3681
1,"St Xaviers Coll, Tamil Nadu, India",3682
1,"Staatl Museum Nat Stuttgart, Stuttgart, Germany",3683
1,"STAATLICHE BAKTERIOL UNTERSUCHUNGSANSTALT ERLANGEN, ERLANGEN, WEST GERMANY",3684
1,"Staatliches Museum Naturkunde Stuttgart, Stuttgart, Germany",3685
1,"Standardizat Author Vietnam, Hanoi, Vietnam",3686
3,"Stanford Univ, Pacific Grove, CA USA",3687
3,"Stanford Univ, Stanford, CA USA",3688
1,"Stat Nat, Omsk, Russia",3689
1,"State Forestry Serv Texel, Texel, Netherlands",3690
1,"State Inst Fisheries Technol, Kakinada, India",3691
1,"State Islamic Univ Malang, Malang, Indonesia",3692
1,"State Ocean Adm, Hangzhou, Peoples R China",3693
1,"State Ocean Adm, Qingdao, Peoples R China",3694
1,"State Ocean Adm, Xiamen, Peoples R China",3695
2,"State Polytech Coll Palawan, Puerto Princesa, Philippines",3696
1,"State Polytech Malang, East Java, Indonesia",3697
9,"State Univ Ghent, Ghent, Belgium",3698
1,"State Univ Makassar, Makassar, Indonesia",3699
1,"State Univ Malang, East Java, Indonesia",3700
1,"State Univ Papua UNIPA, Papua Barat Pro, Indonesia",3701
2,"State Univ Papua, Papua Barat Pro, Indonesia",3702
1,"State Univ Zanzibar, Zanzibar, Tanzania",3703
1,"Stn Mediterraneenne Environm Littoral, Sete, France",3704
1,"Stn Nat, Omsk, Russia",3705
2,"Stn Naturalists, Omsk, Russia",3706
1,"Stn Rech Oceanog & Sous Marines, Calvi, France",3707
1,"Stn Zool Anton Dohrn, Naples, Italy",3708
1,"Stockholm Resilience Ctr, Stockholm, Sweden",3709
4,"Stockholm Univ, Stockholm, Sweden",3710
1,"Stratton Rd, Avon, England",3711
1,"Stuttgart State Museum Nat Hist, Stuttgart, Germany",3712
2,"Suan Dusit Rajabhat Univ, Bangkok, Thailand",3713
1,"Suan Sunandha Rajabhat Univ, Bangkok, Thailand",3714
1,"Suansunandharajabhat Univ, Bangkok, Thailand",3715
1,"SubReg Off Pacific, Apia, Western Samoa",3716
1,"Subsecretaria Pesca, Valparaiso, Chile",3717
3,"Suez Canal Univ, Ismailia, Egypt",3718
1,"Sul Ross State Univ, Alpine, TX USA",3719
2,"Sultan Idris Educ Univ, Perak, Malaysia",3720
1,"Sultan Qaboos Uiv, Al Khoud, Oman",3721
3,"Sultan Qaboos Univ, Al Khoud, Oman",3722
1,"Sultan Qaboos Univ, Al Khud, Oman",3723
1,"Sultan Qaboos Univ, Muscat, Oman",3724
1,"Sultan Quaboos Univ, Muscat, Oman",3725
1,"Sultan Zainal Abidin Univ, Kuala Terengganu, Malaysia",3726
1,"Sumba Fdn, Bali, Indonesia",3727
28,"Sun Yat Sen Univ, Guangdong, Peoples R China",3728
3,"Sun Yat Sen Univ, Guangzhou, Peoples R China",3729
1,"Sun Yat Sen Univ, Zhuhai, Peoples R China",3730
1,"Sun Yat Sen Zhongshan Univ, Guangdong, Peoples R China",3731
1,"Sungkyunkwan Univ, Gyeonggi Do, South Korea",3732
1,"Sungkyunkwan Univ, Seoul, South Korea",3733
1,"Sungkyunkwan Univ, Suwon, South Korea",3734
1,"Sunway Med Ctr, Selangor, Malaysia",3735
1,"Suny Downstate Med Ctr, Brooklyn, NY USA",3736
1,"SUNY Stony Brook, Stony Brook, NY USA",3737
1,"SUNY Upstate Med Univ, Syracuse, NY USA",3738
5,"Suranaree Univ Technol, Nakhon Ratchasi, Thailand",3739
18,"Suranaree Univ Technol, Nakhon Ratchasima, Thailand",3740
1,"Suranaree Univ Technol, Nakon Ratchasima, Thailand",3741
1,"Suranaree Univ Technol, Nakonratchasima, Thailand",3742
1,"Suratthani Inland Fisheries Dev Ctr, Suratthani, Thailand",3743
1,"Surigao State Coll Technol, Siargao Isl, Philippines",3744
1,"Surindra Rajabhat Univ, Maung District, Thailand",3745
1,"Surindra Rajabhat Univ, Muang, Thailand",3746
9,"Surindra Rajabhat Univ, Surin, Thailand",3747
1,"Sustainable Fisheries Partnership, Honolulu, HI USA",3748
1,"Sustainable Trade Initiat, Hanoi, Vietnam",3749
1,"SW Asian Fisheries Dev Ctr, Iloilo, Philippines",3750
2,"SW Fisheries Sci Ctr, La Jolla, CA USA",3751
1,"SW Jiaotong Univ, Chengdu, Peoples R China",3752
3,"SW Texas State Univ, San Marcos, TX USA",3753
1,"Swanaree Univ Technol, Nakhon Ratchasilma, Thailand",3754
1,"Swansea Univ, W Glam, Wales",3755
5,"Swedish Museum Nat Hist, Stockholm, Sweden",3756
1,"Swedish Univ Agr Sci, Uppsala, Sweden",3757
3,"Swinburne Univ Technol, Sarawak, Malaysia",3758
1,"Swinburne Univ Technol, Vic, Australia",3759
1,"Swiss Fed Inst Aquat Sci & Technol EAWAG, Dubendorf, Switzerland",3760
1,"Swiss Fed Inst Technol, Zurich, Switzerland",3761
1,"Swiss Trop & Publ Hlth Inst Swiss TPH, Basel, Switzerland",3762
11,"Swiss Trop & Publ Hlth Inst, Basel, Switzerland",3763
3,"Swiss Trop Inst, Basel, Switzerland",3764
1,"Sydney Grammar Sch, NSW, Australia",3765
2,"Sydney Inst Marine Sci, NSW, Australia",3766
2,"Syiah Kuala Univ, Banda Aceh, Indonesia",3767
1,"Syiah Kuala Univ, Nad, Indonesia",3768
7,"Sylhet Agr Univ, Sylhet, Bangladesh",3769
1,"Szent Istvan Univ, Godollo, Hungary",3770
1,"TA, Montpellier, France",3771
1,"Taipei Coll Maritime Technol, Taipei, Taiwan",3772
1,"Taipei Med Univ, Taipei, Taiwan",3773
2,"Taiwan Endem Species Res Inst, Nantou County, Taiwan",3774
1,"Taiwan Fisheries Res Inst, Chilung, Taiwan",3775
1,"Taiwan Fisheries Res Inst, Pingtung, Taiwan",3776
1,"Taiwan Forestry Res Inst, Kaohsiung Cty, Taiwan",3777
2,"Taiwan Ocean Res Inst, Kaohsiung, Taiwan",3778
1,"Taiwan Wetland Soc, Hsinchu, Taiwan",3779
1,"Taiyuan Univ Technol, Taiyuan, Peoples R China",3780
1,"Tajen Univ Sci & Technol, Pingtung, Taiwan",3781
3,"Tajen Univ, Pingtung, Taiwan",3782
1,"Takahata Hosp, Yamagata, Japan",3783
1,"Takano Hosp, Kumamoto, Japan",3784
1,"TaKaRa Biotechnol Dalian Co Ltd, Dalian, Peoples R China",3785
1,"Takuyo Co Ltd, Kumamoto, Japan",3786
1,"Taman Damai, Sabah, Malaysia",3787
1,"Tamil Nadu Agr Univ, Tamil Nadu, India",3788
1,"Tamil Nadu Vet & Anim Sci Univ, Tuticorin, India",3789
1,"Tamilnadu Vet & Anim Sci Univ, Tamil Nadu, India",3790
1,"Tamkang Univ, New Taipei, Taiwan",3791
2,"Tan Tock Seng Hosp, Singapore, Singapore",3792
1,"Tanjungpura Univ, Pontianak, Indonesia",3793
1,"Tanta Univ, Tanta, Egypt",3794
1,"Tanzania Forest Serv, Dar Es Salaam, Tanzania",3795
1,"Tanzania Forestry Res Inst, Kibaha, Tanzania",3796
1,"Taralabalu Krishi Vigyan Kendra, Davanagere, India",3797
10,"Tarbiat Modares Univ, Mazandaran, Iran",3798
1,"Tarbiat Modares Univ, Noor, Iran",3799
1,"Tarbiat Modares Univ, Tehran, Iran",3800
1,"Taronga Western Plains Zoo, NSW, Australia",3801
1,"Tarumanagara Univ, Barat, Indonesia",3802
2,"Tay Nguyen Univ, Buon Ma Thuot, Vietnam",3803
1,"Taylors Univ, Selangor, Malaysia",3804
1,"TBRI, Imbaba, Egypt",3805
1,"Team Blue Earth Co Ltd, Tokyo, Japan",3806
1,"TEAM Consulting Engn & Management Co Ltd, Bangkok, Thailand",3807
2,"Tech Univ Carolo Wilhelmina Braunschweig, Braunschweig, Germany",3808
1,"Tech Univ Denmark, Charlettenlund, Denmark",3809
1,"Tech Univ Denmark, Charlottenlund, Denmark",3810
1,"Tech Univ Denmark, Hirtshals, Denmark",3811
1,"Tech Univ Denmark, Lyngby, Denmark",3812
1,"Tech Univ Dresden, Dresden, Germany",3813
5,"Tech Univ Dresden, Tharandt, Germany",3814
3,"Tech Univ Munich, Freising Weihenstephan, Germany",3815
1,"Tech Univ Munich, Garching, Germany",3816
1,"Technol Inst Bandung, Bandung, Indonesia",3817
1,"Technol Univ MARA, Shah Alam, Malaysia",3818
1,"Teknik Janakuasa SDN BHD, Pantai Remis, Malaysia",3819
5,"Tel Aviv Univ, Tel Aviv, Israel",3820
1,"TEL HASHOMER HOSP, TEL AVIV, ISRAEL",3821
1,"Tel Shikmona, Haifa, Israel",3822
8,"Temasek Life Sci Lab, Singapore, Singapore",3823
1,"Temko Corp, Tokyo, Japan",3824
1,"Teo Way Yong & Sons Pte Ltd, Singapore, Singapore",3825
2,"Texas A&M Univ Syst, Dallas, TX USA",3826
3,"Texas A&M Univ, College Stn, TX USA",3827
1,"Texas A&M Univ, Corpus Christi, TX USA",3828
1,"Texas A&M Univ, Galveston, TX USA",3829
1,"Texas Christian Univ, Ft Worth, TX USA",3830
1,"Texas Tech Univ, Lubbock, TX USA",3831
1,"Texas Vet Med Diagnost Labs, College Stn, TX USA",3832
1,"THAI GERMAN INST, BANGKOK, THAILAND",3833
1,"Thai Nguyen Univ Agr, Thai Nguyen, Vietnam",3834
2,"THAILAND INST SCI & TECHNOL RES, BANGKOK, THAILAND",3835
2,"Thailand Inst Sci & Technol Res, Pathum Thani, Thailand",3836
1,"Thailand Inst Sci & Technol Res, Pathumthani, Thailand",3837
1,"Thailand Text Inst, Bangkok, Thailand",3838
1,"Thaksin Univ, Phathalung, Thailand",3839
6,"Thaksin Univ, Phattalung, Thailand",3840
2,"Thaksin Univ, Phatthalung, Thailand",3841
1,"Thaksin Univ, Song Khla, Thailand",3842
1,"Thammasart Univ, Pathumthani, Thailand",3843
1,"Thammasart Univ, Pratumthani, Thailand",3844
31,"Thammasat Univ, Pathum Thani, Thailand",3845
2,"Thammasat Univ, Pathumthani, Thailand",3846
1,"Thammasat Univ, Prathum Thani, Thailand",3847
1,"Thammsat Univ, Phathumthani, Thailand",3848
1,"The Holden Arboretum, Kirtland, OH USA",3849
2,"Thepsatri Rajabhat Univ, Lopburi, Thailand",3850
1,"Third Inst Oceanog State Ocean Adm, Xiamen, Peoples R China",3851
1,"Thiruvalluvar Univ, Tamil Nadu, India",3852
1,"Thongmee Co Ltd, Bangkok, Thailand",3853
1,"Thunen Inst Balt Sea Fisheries TI OF, Rostock, Germany",3854
1,"Tianjin Agr Coll, Tianjin, Peoples R China",3855
3,"Tianjin Fisheries Res Inst, Tianjin, Peoples R China",3856
2,"Tianjin Fisheries Technol Promot Stn, Tianjin, Peoples R China",3857
3,"Tianjin Univ Sci & Technol, Tianjin, Peoples R China",3858
1,"Tibet Univ, Tibetan AR, Peoples R China",3859
2,"TISTR, Pathum Thani, Thailand",3860
1,"Tlekung Res & Assessment Installat Agr Technol, E Java, Indonesia",3861
1,"TOA Paint Thailand Co Ltd, Samuthprakarn, Thailand",3862
2,"Toho Univ, Chiba, Japan",3863
1,"Tohoku Gakuin Univ, Miyagi, Japan",3864
1,"Tohoku Med & Pharmaceut Univ, Miyagi, Japan",3865
3,"Tohoku Natl Fisheries Res Inst, Aomori, Japan",3866
6,"Tohoku Pharmaceut Univ, Miyagi, Japan",3867
1,"Tohoku Univ, Aomori, Japan",3868
19,"Tohoku Univ, Miyagi, Japan",3869
9,"Tokai Univ, Shizuoka, Japan",3870
1,"Tokai Univ, Tokyo, Japan",3871
1,"Tokushima Agr Forestry & Fisheries Technol Suppor, Tokushima, Japan",3872
1,"Tokyo Healthcare Univ, Tokyo, Japan",3873
3,"Tokyo Inst Technol, Tokyo, Japan",3874
2,"Tokyo Med & Dent Univ, Chiba, Japan",3875
2,"Tokyo Med Univ, Tokyo, Japan",3876
1,"Tokyo Metropolitan Inst Med Sci, Tokyo, Japan",3877
2,"Tokyo Metropolitan Univ, Tokyo, Japan",3878
1,"Tokyo Univ Agr & Technol, Tokyo, Japan",3879
3,"Tokyo Univ Agr, Hokkaido, Japan",3880
3,"Tokyo Univ Agr, Tokyo, Japan",3881
19,"Tokyo Univ Fisheries, Tokyo, Japan",3882
2,"Tokyo Univ Marine Sci & Technol, Chiba, Japan",3883
81,"Tokyo Univ Marine Sci & Technol, Tokyo, Japan",3884
5,"Tokyo Univ Technol, Tokyo, Japan",3885
6,"Tongji Univ, Shanghai, Peoples R China",3886
1,"Tottori Univ, Tottori, Japan",3887
1,"Towa Kagaku Co Ltd, Hiroshima, Japan",3888
5,"Toyama Univ, Toyama, Japan",3889
1,"Toyohashi Univ Technol, Aichi, Japan",3890
1,"TRAFF SE Asia, Selangor, Malaysia",3891
1,"Trang Coastal Fisheries Res & Dev Ctr, Trang, Thailand",3892
1,"Trent Univ, Peterborough ON, Canada",3893
1,"Trinity Coll Dublin, Dublin, Ireland",3894
1,"Trinity Univ Asia, Quezon City, Philippines",3895
1,"Trinity Univ, San Antonio, TX USA",3896
1,"Trisakti Univ, Jakarta, Indonesia",3897
1,"Triton Aquaculture Africa Ltd, Lagos, Nigeria",3898
2,"Trop Marine Res, San Diego, CA USA",3899
1,"Truman State Univ, Kirksville, MO USA",3900
2,"Tsing Hua Univ, Beijing, Peoples R China",3901
3,"Tsinghua Univ, Beijing, Peoples R China",3902
1,"TU Bergakad Freiberg, Freiberg, Germany",3903
1,"Tufts Univ, Medford, MA USA",3904
1,"Tufts Univ, N Grafton, MA USA",3905
1,"Tufts Univ, North Grafton, MA USA",3906
1,"Tulane Univ, Belle Chasse, LA USA",3907
1,"TUMEC, Terengganu, Malaysia",3908
1,"Tun Khit Fdn, Yangon, Myanmar",3909
2,"Turtle & Marine Ecosyst Ctr TUMEC, Terengganu, Malaysia",3910
1,"Turtle & Marine Ecosyst Ctr, Terengganu, Malaysia",3911
4,"Tyumen State Univ, Tyumen, Russia",3912
1,"UAE Univ, Al Ain, U Arab Emirates",3913
1,"UAFH, Vn Hue City, Vietnam",3914
1,"UAS, Mangalore, India",3915
1,"UBA, Buenos Aires DF, Argentina",3916
1,"Ubon Ratchathani Rajabhat Univ, Ubon Ratchathan, Thailand",3917
1,"Ubon Ratchathani Rajabhat Univ, Ubon Ratchathani, Thailand",3918
5,"Ubon Ratchathani Univ, Ubon Ratchathan, Thailand",3919
5,"Ubon Ratchathani Univ, Ubon Ratchathani, Thailand",3920
1,"Ubon Rice Res Ctr, Ubon Ratchathani, Thailand",3921
2,"UCL, London, England",3922
1,"UCL, Louvain, Belgium",3923
1,"UCLA DOE, Los Angeles, CA USA",3924
1,"UCLM, Ciudad Real, Spain",3925
4,"UCSI Univ, Kuala Lumpur, Malaysia",3926
10,"Udayana Univ, Bali, Indonesia",3927
1,"Udayana Univ, Udayana, Indonesia",3928
1,"Udon Thani Rajabhat Univ, Udon Thani, Thailand",3929
1,"UFJF, Juiz De Fora, Brazil",3930
1,"UFPA, Para, Brazil",3931
1,"UFR Sci, Orleans, France",3932
1,"UFRRJ, Seropedica RJ, Brazil",3933
1,"UFV, Valencia, Spain",3934
1,"UHI, Argyll, Scotland",3935
1,"UIB, Mallorca, Spain",3936
1,"UiTM Puncak Alam, Kuala Selangor, Malaysia",3937
2,"UJAT, Tabasco, Mexico",3938
1,"UKT, Kuala Lumpur, Malaysia",3939
1,"ULB, Brussels, Belgium",3940
1,"Ulyanovsk State Univ, Ulyanovsk, Russia",3941
1,"UM1 CNRS IRD, Cotonou, Benin",3942
1,"UM1 UM2 CNRS5290 IRD, Montpellier, France",3943
1,"Umaru Musa Yaradua Univ, Katsina, Nigeria",3944
1,"Umea Univ, Hornefors, Sweden",3945
2,"Umea Univ, Umea, Sweden",3946
1,"UMP, Pahang, Malaysia",3947
1,"UMR AGAP, Montpellier, France",3948
1,"UMR AMAP, Montpellier, France",3949
2,"UMT, Kuala Terengganu, Malaysia",3950
3,"UMT, Terengganu, Malaysia",3951
1,"UN Childrens Fund UNICEF, Kathmandu, Nepal",3952
1,"UN World Food Programme, West Timor, Indonesia",3953
1,"UnB, Brasilia DF, Brazil",3954
1,"Underwater World Singapore, Sentosa, Singapore",3955
2,"UNESCO IHE Inst Water Educ, Delft, Netherlands",3956
1,"UNESCO, Beijing, Peoples R China",3957
1,"UNESP Univ Estadual Paulista, Rio Claro SP, Brazil",3958
1,"UNESP, Bauru SP, Brazil",3959
1,"UNESP, Botucatu SP, Brazil",3960
1,"Uni President Vietnam Co Ltd, Binh Duong, Vietnam",3961
1,"UNICEF, Jakarta, Indonesia",3962
3,"Uniformed Serv Univ Hlth Sci, Bethesda, MD USA",3963
1,"UNIPA, Irian Jaya Bara, Indonesia",3964
1,"United Nations Univ, Kuala Lumpur, Malaysia",3965
6,"Univ Aarhus, Aarhus C, Denmark",3966
3,"Univ Aarhus, Aarhus N, Denmark",3967
2,"Univ Aarhus, Aarhus, Denmark",3968
1,"Univ Abdou Moumouni, Niamey, Niger",3969
1,"Univ Aberdeen, Aberdeen AB2 2UE, Scotland",3970
4,"Univ Aberdeen, Aberdeen AB24 2TZ, Scotland",3971
1,"Univ Aberdeen, Aberdeen AB24 3UE, Scotland",3972
1,"Univ Aberdeen, Aberdeen AB9 1FX, Scotland",3973
1,"Univ Aberdeen, Aberdeen, Scotland",3974
3,"Univ Abomey Calavi, Cotonou, Benin",3975
1,"Univ Acores, Acores, Portugal",3976
1,"Univ Addis Ababa, Addis Ababa, Ethiopia",3977
2,"Univ Adelaide, Adelaide SA, Australia",3978
13,"Univ Adelaide, SA, Australia",3979
1,"Univ Agr & Foresterie, Ho Chi Minh Ville, Vietnam",3980
1,"Univ Agr & Forestry, Ho Chi Minh City, Vietnam",3981
3,"Univ Agr Faisalabad, Faisalabad, Pakistan",3982
1,"Univ Agr Sci Bangalore, Karnataka, India",3983
1,"Univ Agr Sci Mangalore, Karnataka, India",3984
6,"Univ Agr Sci Mangalore, Mangalore, India",3985
1,"Univ Agr Sci, Karnataka, India",3986
1,"Univ Agr Sci, Sirsi, India",3987
1,"Univ Agr, Makurdi, Nigeria",3988
1,"Univ Agustin, Iloilo, Philippines",3989
1,"Univ Airlangga, Surabaya, Indonesia",3990
2,"Univ Aix Marseille, Marseille, France",3991
1,"Univ Akron, Akron, OH USA",3992
1,"Univ Al Anbar, Al Anbar, Iraq",3993
1,"Univ Alabama Birmingham, Birmingham, AL USA",3994
1,"Univ Alaska Fairbanks, Fairbanks, AK USA",3995
1,"Univ Alaska Fairbanks, Kodiak, AK USA",3996
6,"Univ Alberta, Edmonton AB, Canada",3997
2,"Univ Alcala De Henares, Alcala De Henares, Spain",3998
2,"Univ Alexandria, Alexandria, Egypt",3999
2,"Univ Algarve, Faro, Portugal",4000
1,"Univ Alicante Ayuntamiento Santa Pola, Alicante, Spain",4001
1,"Univ Alicante, Alicante, Spain",4002
18,"Univ Amsterdam, Amsterdam, Netherlands",4003
1,"UNIV AMSTERDAM, DH AMSTERDAM, NETHERLANDS",4004
1,"Univ Ancona, Ancona, Italy",4005
1,"Univ Andalas, Padang, Indonesia",4006
1,"Univ Andalas, Sumatera Barat, Indonesia",4007
1,"Univ Andalas, West Sumatera, Indonesia",4008
1,"Univ Anim & Fisheries Sci, Mangalore, India",4009
1,"Univ Antilles Guyane, Cayenne, French Guiana",4010
1,"Univ Antioquia, Medellin, Colombia",4011
1,"Univ Antofagasta, Antofagasta, Chile",4012
5,"Univ Antwerp, Antwerp, Belgium",4013
1,"Univ Appl Sci & Arts Northwestern Switzerland, Windisch, Switzerland",4014
1,"Univ Arid Agr, Rawalpindi, Pakistan",4015
24,"Univ Arizona, Tucson, AZ USA",4016
2,"Univ Arkansas, Fayetteville, AR USA",4017
7,"Univ Auckland, Auckland, New Zealand",4018
3,"Univ Auckland, Warkworth, New Zealand",4019
2,"Univ Austral Chile, Valdivia, Chile",4020
1,"Univ Autonoma Aguascalientes, Aguascalientes, Mexico",4021
2,"Univ Autonoma Barcelona, Barcelona, Spain",4022
2,"Univ Autonoma Madrid, Madrid, Spain",4023
2,"Univ Autonoma Nuevo Leon, Nuevo Leon, Mexico",4024
1,"Univ Autonoma Queretaro, Queretaro, Mexico",4025
1,"Univ Autonoma Yucatan, Yucatan, Mexico",4026
20,"Univ Aveiro, Aveiro, Portugal",4027
1,"Univ Balochistan, Quetta, Pakistan",4028
2,"Univ Bamako, Bamako, Mali",4029
1,"Univ Bangka Belitung, Balunijuk, Indonesia",4030
1,"Univ Bangor, Gwynedd, Wales",4031
1,"Univ Barcelona, Barcelona, Spain",4032
12,"Univ Basel, Basel, Switzerland",4033
1,"Univ Basilicata, Potenza, Italy",4034
1,"Univ Basque Country, Vitoria, Spain",4035
5,"Univ Bath, Avon, England",4036
2,"Univ Bayreuth, Bayreuth, Germany",4037
1,"Univ Behbehan, Behbehan, Iran",4038
1,"Univ Belgrade, Belgrade, Serbia",4039
1,"Univ Bengkulu, Bengkulu, Indonesia",4040
1,"Univ Benin, Lome, Togo",4041
7,"Univ Bergen, Bergen, Norway",4042
1,"Univ Bern, Bern, Switzerland",4043
1,"Univ Bielefeld, Bielefeld, Germany",4044
1,"Univ Birjand, Birjand, Iran",4045
8,"Univ Birmingham, W Midlands, England",4046
1,"Univ Blaise Pascal, Aubiere, France",4047
2,"Univ Bologna, Bologna, Italy",4048
1,"Univ Bologna, Ravenna, Italy",4049
4,"Univ Bonn, Bonn, Germany",4050
1,"Univ Bourgogne Franche Comte, Besancon, France",4051
2,"Univ Bourgogne, Dijon, France",4052
1,"Univ Brasilia, Brasilia DF, Brazil",4053
3,"Univ Brawijaya, East Java, Indonesia",4054
1,"Univ Brawijaya, Jawa Timur, Indonesia",4055
3,"Univ Brawijaya, Malang, Indonesia",4056
12,"Univ Bremen, Bremen, Germany",4057
2,"Univ Bretagne Occidentale, Plouzane, France",4058
1,"Univ Bretagne Sud, Lorient, France",4059
1,"Univ Bretagne Sud, Vannes, France",4060
1,"Univ Brighton, E Sussex, England",4061
4,"Univ Bristol, Avon, England",4062
18,"Univ British Columbia, Vancouver BC, Canada",4063
1,"UNIV BRITISH COLUMBIA, VANCOUVER V6H 3N1 BC, CANADA",4064
1,"Univ British Columbia, W Vancouver BC, Canada",4065
1,"Univ Brunei Darussalam Jalan Tungku Link, Gadong, Brunei",4066
3,"Univ Brunei Darussalam, Bandar Seri Begawan, Brunei",4067
1,"Univ Brunei Darussalam, Brunei Darussalam, Brunei",4068
1,"Univ Brunei Darussalam, Darussalam, Brunei",4069
14,"Univ Brunei Darussalam, Gadong, Brunei",4070
3,"Univ Brunei Darussalam, Jalan Tungku Link, Brunei",4071
1,"Univ Brunei Darussalam, Jalan Tungku, Brunei",4072
3,"Univ Brunei Darussalam, Negara, Brunei",4073
1,"Univ Brunei, Brunei Darussal, Brunei",4074
1,"Univ Brunei, Darussalam, Brunei",4075
1,"Univ Brunei, Gadong, Brunei",4076
1,"Univ Bucharest, Bucharest, Romania",4077
1,"Univ Buenos Aires, Buenos Aires DF, Argentina",4078
1,"Univ Burdwan, W Bengal, India",4079
1,"Univ Ca Foscari Venezia, Venice, Italy",4080
2,"Univ Cadiz, Cadiz, Spain",4081
1,"Univ Cadiz, Puerto Real, Spain",4082
1,"Univ Caen Basse Normandie, Caen, France",4083
1,"Univ Caen Normandie, Caen, France",4084
1,"Univ Calabar, Calabar, Nigeria",4085
2,"Univ Calcutta, Kolkata, India",4086
1,"Univ Calcutta, W Bengal, India",4087
4,"Univ Calgary, Calgary AB, Canada",4088
20,"Univ Calif Berkeley, Berkeley, CA USA",4089
1,"Univ Calif Bodega, Bodega Bay, CA USA",4090
3,"Univ Calif Davis, Bodega Bay, CA USA",4091
18,"Univ Calif Davis, Davis, CA USA",4092
1,"Univ Calif Davis, Tulare, CA USA",4093
2,"Univ Calif Irvine, Irvine, CA USA",4094
16,"Univ Calif Los Angeles, Los Angeles, CA USA",4095
1,"Univ Calif Riverside, Riverside, CA USA",4096
14,"Univ Calif San Diego, La Jolla, CA USA",4097
2,"Univ Calif San Diego, San Diego, CA USA",4098
7,"Univ Calif Santa Barbara, Santa Barbara, CA USA",4099
13,"Univ Calif Santa Cruz, Santa Cruz, CA USA",4100
1,"Univ Calif, Merced, CA USA",4101
5,"Univ Cambridge, Cambridge, England",4102
1,"Univ Can Tho, Can Tho City, Vietnam",4103
6,"Univ Can Tho, Can Tho, Vietnam",4104
2,"Univ Canberra, ACT, Australia",4105
12,"Univ Canterbury, Christchurch, New Zealand",4106
1,"Univ Cape Coast, Cape Coast, Ghana",4107
1,"Univ Cape Town, Cape Town, South Africa",4108
3,"Univ Cape Town, Rondebosch, South Africa",4109
3,"Univ Catolica Norte, Coquimbo, Chile",4110
1,"Univ Catolica Santisima, Concepcion, Chile",4111
3,"Univ Cent Florida, Orlando, FL USA",4112
2,"Univ Cent Queensland, Qld, Australia",4113
1,"Univ Cheikh Anta Diop UCAD Dakar, Dakar, Senegal",4114
2,"Univ Chicago, Chicago, IL USA",4115
1,"Univ Chile, Santiago, Chile",4116
17,"Univ Chinese Acad Sci, Beijing, Peoples R China",4117
10,"Univ Chittagong, Chittagong, Bangladesh",4118
1,"Univ Chouaib Doukkali, El Jadida, Morocco",4119
1,"Univ Ciencias Med, Villa Clara, Cuba",4120
1,"Univ Coimbra, Coimbra, Portugal",4121
1,"Univ Colima, Colima, Mexico",4122
4,"Univ Coll Cork, Cork, Ireland",4123
3,"Univ Coll N Wales, Gwynedd, Wales",4124
1,"Univ Coll Sci & Technol KUSTEM, Kuala Terenggan, Malaysia",4125
1,"Univ Coll Sci & Technol Malaysia KUSTEM, Kuala Terengganu, Malaysia",4126
3,"Univ Coll Sci & Technol Malaysia, Kuala Terengganu, Malaysia",4127
1,"Univ Coll Sci & Technol Malaysia, Terengganu, Malaysia",4128
1,"Univ Coll Southeast Norway, Bo I Telemark, Norway",4129
6,"Univ Coll Swansea, W Glam, Wales",4130
1,"Univ Cologne, Cologne, Germany",4131
1,"Univ Colombo, Colombo, Sri Lanka",4132
1,"Univ Complutense Madrid, Madrid, Spain",4133
4,"Univ Complutense, Madrid, Spain",4134
4,"Univ Concepcion, Concepcion, Chile",4135
1,"Univ Connecticut, Storrs, CT USA",4136
3,"Univ Copenhagen, Copenhagen K, Denmark",4137
4,"Univ Copenhagen, Copenhagen O, Denmark",4138
17,"Univ Copenhagen, Copenhagen, Denmark",4139
12,"Univ Copenhagen, Frederiksberg C, Denmark",4140
1,"Univ Copenhagen, Frederiksberg C4, Denmark",4141
7,"Univ Copenhagen, Frederiksberg, Denmark",4142
1,"Univ Copenhagen, Frederksberg C, Denmark",4143
6,"Univ Copenhagen, Helsingor, Denmark",4144
3,"Univ Copenhagen, Hillerod, Denmark",4145
1,"Univ Costa Rica, San Jose, Costa Rica",4146
1,"Univ Cumbria, Penrith, England",4147
1,"Univ dAbomey Calavi, Cotonou, Benin",4148
2,"Univ Dar Es Salaam, Zanzibar, Tanzania",4149
1,"Univ Darul Iman Malaysia, Terengganu, Malaysia",4150
1,"Univ Darul Iman, Terengganu, Malaysia",4151
1,"Univ Delaware, Lewes, DE USA",4152
1,"Univ Delhi, Delhi, India",4153
1,"Univ Denver, Denver, CO USA",4154
1,"Univ Derby, Derby, England",4155
