records,locations,id
1,"Edinburgh Napier Univ, Midlothian, Scotland",1057
1,"Edmund Mach Fdn, Trento, Italy",1058
1,"Ehime Fisheries Res Ctr, Ehime, Japan",1059
1,"Ehime Prefectural Fish Dis Control Ctr, Ehime, Japan",1060
1,"Ehime Prefectural Fisheries Expt Stn, Ehime, Japan",1061
1,"Ehime Res Inst Agr Forestry & Fisheries, Ehime, Japan",1062
22,"Ehime Univ, Ehime, Japan",1063
1,"Eijkman Inst Mol Biol, Jakarta, Indonesia",1064
1,"Eisai & Co Ltd, Ibaraki, Japan",1065
2,"Eisai & Co Ltd, Tokyo, Japan",1066
1,"El Col Frontera Sur, Quintana Roo, Mexico",1067
1,"EMBRAPA Fisheries & Aquaculture, Palmas TO, Brazil",1068
2,"Embrapa Recursos Genet & Biotecnol, Brasilia DF, Brazil",1069
1,"EMBRAPA, Brasilia DF, Brazil",1070
1,"EMBRAPA, Santo Antonio De Goias Go, Brazil",1071
1,"Emergency Ctr Transboundary Anim Dis, Hanoi, Vietnam",1072
2,"Emirates Marine Environm Grp, Dubai, U Arab Emirates",1073
1,"Emirates Wildlife Soc World Wide Fund Nat, Abu Dhabi, U Arab Emirates",1074
1,"Emory Univ, Atlanta, GA USA",1075
1,"Endem Species Res Inst, Nantou, Taiwan",1076
1,"ENEA, La Spezia, Italy",1077
2,"Engle Stone Aquat LLC, Strasburg, VA USA",1078
2,"Environm & Protected Areas Author, Sharjah, U Arab Emirates",1079
2,"Environm Agcy Abu Dhabi, Abu Dhabi, U Arab Emirates",1080
1,"Environm Agcy, Cambs, England",1081
1,"Environm Canada, ON L7 4A6, Canada",1082
1,"Environm Def Fund, New York, NY USA",1083
1,"Environm Protect Author Victoria, Vic, Australia",1084
1,"Environm Resources Management, Kuala Lumpur, Malaysia",1085
2,"Environm Soc Oman, Ruwi, Oman",1086
2,"EPHE, Moorea, Fr Polynesia",1087
1,"Epicore BioNetworks Inc, Eastampton, NJ USA",1088
1,"Equipe Environm & Xenobiot, Grenoble, France",1089
1,"Escuela Ingn Agron, Caracas, Venezuela",1090
1,"Escuela Super Med IPN, Mexico City DF, Mexico",1091
1,"Escuela Super Politecn Litoral ESPOL, Guayaquil, Ecuador",1092
1,"Estn Expt Zonas Aridas EEZA CSIC, Almeria, Spain",1093
1,"Estn Invest Jaume Ferrer, Illes Balears, Spain",1094
1,"ETH, Zurich, Switzerland",1095
9,"Eulji Univ, Taejon, South Korea",1096
1,"Exomed Inst Vet Med Betreuung Niederer Wirbeltier, Berlin, Germany",1097
1,"Fac Agr, Okayama, Japan",1098
2,"Fac Agr, Selangor, Malaysia",1099
1,"Fac Agro Ind & Nat Resources, Kelantan, Malaysia",1100
1,"Fac Agro Ind, Songkhla, Thailand",1101
1,"Fac Agron, Montevideo, Uruguay",1102
1,"Fac Biosci Engn, Ghent, Belgium",1103
1,"Fac Marine & Fisheries Sci, Makassar, Indonesia",1104
1,"Fac Marine & Fisheries, Makassar, Indonesia",1105
1,"Fac Med Nursing & Hlth Sci, Vic, Australia",1106
1,"Fac Med Pitie Salpetriere, Paris, France",1107
1,"Fac Med, Limoges, France",1108
1,"Fac Med, Sanaa, Yemen",1109
1,"Fac Pharm, Limoges, France",1110
1,"Fac Pharm, Paris, France",1111
1,"Fac Publ Hlth, Bangkok, Thailand",1112
1,"Fac Sci Tunis, El Manar II, Tunisia",1113
1,"Fac Univ Notre Dame Paix, Namur, Belgium",1114
2,"Fac Vet Med, Khon Kaen, Thailand",1115
1,"Fac Vet Med, Merelbeke, Belgium",1116
1,"Fac Vet, Selangor, Malaysia",1117
1,"Far E State Univ, Vladivostok, Russia",1118
1,"FAR E STATE UNIV, VLADIVOSTOK, USSR",1119
10,"Far Eastern Fed Univ, Vladivostok, Russia",1120
1,"Far Eastern Natl Univ, Vladivostok, Russia",1121
1,"FCQB UAS, Sinaloa, Mexico",1122
1,"Fdn Conservat Nat Resources, Cebu, Philippines",1123
1,"Fdn Ivo Carneri, Turin, Italy",1124
1,"Fdn Ivo de Carneri, Milan, Italy",1125
1,"Fdn Med Trop Amazonas, Bairro D Pedro, Brazil",1126
1,"Fdn Omacha, Bogota, Colombia",1127
1,"Fdn Protect Marine Megafauna, Inhambane, Mozambique",1128
1,"Fdn Sustainable Dev, Wageningen, Netherlands",1129
1,"Fed Adm Ctr, Putrajaya, Malaysia",1130
1,"Fed Coll Educ Tech Bichi, Kano State, Nigeria",1131
1,"Fed Coll Educ, Kano, Nigeria",1132
1,"Fed Inst Geosci & Nat Resources, Hannover, Germany",1133
1,"Fed Res Inst Rural Areas Forestry & Fisheries, Ahrensburg, Germany",1134
1,"Fed Univ Para, Braganca PA, Brazil",1135
1,"Fed Univ Para, Braganca Paulista SP, Brazil",1136
3,"Fed Univ Para, Para, Brazil",1137
2,"Fed Univ Technol Akure, Akure, Nigeria",1138
1,"Fed Univ, Dutsin Ma Katsi, Nigeria",1139
1,"FFC Elasmobranch Studies, New Port Richey, FL USA",1140
1,"FIBOZOPA, Bac Ninh, Vietnam",1141
7,"Field Museum Nat Hist, Chicago, IL USA",1142
2,"Field Museum, Chicago, IL USA",1143
1,"Fiji Natl Univ, Samabula, Fiji",1144
1,"Finnish Inst Marine Res, Helsinki, Finland",1145
1,"Fiocruz MS, Rio De Janeiro, Brazil",1146
1,"Fish & Shellfish Dis Lab, Lelystad, Netherlands",1147
1,"Fish Hlth Res Lab, Jakarta, Indonesia",1148
1,"Fish Quarantine Qual Control & Safety Fish Prod A, Semarang, Indonesia",1149
6,"Fish Vet Grp Asia Ltd, Bangkok, Thailand",1150
1,"Fish Vet Grp Asia, Bangkok, Thailand",1151
1,"FISHBASE Informat & Res Grp, Laguna, Philippines",1152
1,"Fisher Sci M Pte Ltd, Selangor Darul, Malaysia",1153
1,"Fisheries & Oceans Canada, Dartmouth NS, Canada",1154
3,"Fisheries & Oceans Canada, Moncton NB, Canada",1155
2,"Fisheries & Oceans Canada, Nanaimo BC, Canada",1156
1,"Fisheries & Oceans Canada, Sault Ste Marie ON, Canada",1157
2,"Fisheries & Oceans Canada, St Andrews NB, Canada",1158
1,"Fisheries & Oceans Canada, W Vancouver BC, Canada",1159
1,"Fisheries Adm, Phnom Penh, Cambodia",1160
1,"Fisheries Agcy, Ibaraki, Japan",1161
1,"Fisheries Agcy, Mie, Japan",1162
1,"FISHERIES BIOL & FISH DIS, MUNICH, GERMANY",1163
1,"Fisheries Gen Dept, Mazandaran, Iran",1164
1,"Fisheries Grp, NT, Australia",1165
1,"Fisheries Inspector Gen Off, Bangkok, Thailand",1166
1,"Fisheries Res & Educ Agcy, Mie, Japan",1167
1,"Fisheries Res Agcy FRA, Hiroshima, Japan",1168
1,"Fisheries Res Agcy, Aomori, Japan",1169
1,"Fisheries Res Agcy, Hiroshima, Japan",1170
1,"Fisheries Res Agcy, Hokkaido, Japan",1171
1,"Fisheries Res Agcy, Ibaraki, Japan",1172
7,"Fisheries Res Agcy, Kanagawa, Japan",1173
8,"Fisheries Res Agcy, Mie, Japan",1174
7,"Fisheries Res Agcy, Nagasaki, Japan",1175
2,"Fisheries Res Agcy, Niigata, Japan",1176
1,"Fisheries Res Agcy, Oita, Japan",1177
4,"Fisheries Res Agcy, Okinawa, Japan",1178
1,"Fisheries Res Agcy, Onomichi, Japan",1179
1,"Fisheries Res Agcy, Shiogama, Japan",1180
1,"Fisheries Res Ctr, Ehime, Japan",1181
1,"Fisheries Res Inst, Batu Maung, Malaysia",1182
3,"Fisheries Res Inst, George Town, Malaysia",1183
1,"Fisheries Res Inst, Kedah, Malaysia",1184
2,"Fisheries Res Inst, Negeri Sembilan, Malaysia",1185
12,"Fisheries Res Inst, Penang, Malaysia",1186
2,"Fisheries Res Inst, Pingtung, Taiwan",1187
1,"Fisheries Res Inst, Pulau Pinang, Malaysia",1188
1,"Fisheries Technol Dev Inst, Bangkok, Thailand",1189
1,"Fisheries Victoria, Vic, Australia",1190
1,"Fisheries Western Australia, WA, Australia",1191
1,"Fishery Res Inst, Penang, Malaysia",1192
1,"FishPLUS, Kuala Lumpur, Malaysia",1193
1,"Fishries Res Agcy, Mie, Japan",1194
1,"Fishries Res Inst, Kedah, Malaysia",1195
1,"Fiskehelsetjenesten Tromso, Tromso, Norway",1196
2,"Five Oceans Environm Serv LLC, Muscat, Oman",1197
1,"Flanders Hydraul Res, Antwerp, Belgium",1198
1,"Flemish Inst Technol Res VITO, Mol, Belgium",1199
1,"FLI, Greifswald, Germany",1200
1,"Flinders Univ S Australia, Bedford Pk SA, Australia",1201
11,"Flinders Univ S Australia, SA, Australia",1202
2,"Florida Atlantic Univ, Boca Raton, FL USA",1203
1,"Florida Fish & Wildlife Conservat Commiss, St Petersburg, FL USA",1204
1,"Florida Inst Technol, Melbourne, FL USA",1205
2,"Florida Int Univ, Miami, FL USA",1206
2,"Florida Int Univ, N Miami, FL USA",1207
3,"Florida State Univ, Tallahassee, FL USA",1208
1,"FMC BioPolymer, Philadelphia, PA USA",1209
1,"FMC Chem Pty Ltd, Qld, Australia",1210
1,"Food & Agr Org United Nations, Hanoi, Vietnam",1211
1,"Food & Agr Org United Nations, Rome, Italy",1212
1,"Food & Agr Org, Rome, Italy",1213
1,"Food & Drug Adm, Bothell, WA USA",1214
1,"FOOD CROPS RES INST, HAI HUNG, VIETNAM",1215
1,"Food Ind Res Inst, Hanoi, Vietnam",1216
1,"Forest & Forest Prod Res Inst Japan, Ibaraki, Japan",1217
1,"Forest & Plant Conservat Res Off, Bangkok, Thailand",1218
1,"Forest Res Inst Malaysia, Kuala Lumpur, Malaysia",1219
2,"Forest Res Inst Malaysia, Selangor Darul, Malaysia",1220
1,"Forest Res Inst, Uttrakhand, India",1221
1,"Forest Sci Inst South Vietnam, Ho Chi Minh City, Vietnam",1222
1,"Forest Sci Inst Vietnam, Hanoi, Vietnam",1223
2,"Forestry & Forest Prod Res Inst, Ibaraki, Japan",1224
1,"Forestry & Forest Prod Res Inst, Kyoto, Japan",1225
1,"Forestry Univ Hanoi, Hanoi, Vietnam",1226
1,"Forsch Museum Alexander Koenig, Bonn, Germany",1227
2,"Forschungsinst Senckenberg, Hamburg, Germany",1228
1,"Fort Collins Sci Ctr, Ft Collins, CO USA",1229
1,"FRA, Miyagi, Japan",1230
1,"FRA, Niigata, Japan",1231
1,"France Haliotis, Plouguerneau, France",1232
1,"Franklin & Marshall Coll, Lancaster, PA USA",1233
1,"Fred Hutchinson Canc Res Ctr, Seattle, WA USA",1234
2,"Free Univ Amsterdam, Amsterdam, Netherlands",1235
2,"FREE UNIV AMSTERDAM, HV AMSTERDAM, NETHERLANDS",1236
6,"Free Univ Berlin, Berlin, Germany",1237
4,"Free Univ Brussels, Brussels, Belgium",1238
1,"French Inst Pondichery, Pondicherry, India",1239
1,"FRESH Studio Innovat Asia Ltd, Hanoi, Vietnam",1240
1,"Freshwater Aquaculture Collaborat Innovat Ctr Hub, Wuhan, Peoples R China",1241
3,"Freshwater Fisheries Res Ctr, Jelebu, Malaysia",1242
1,"FRI Tanjung Demong, Terengganu, Malaysia",1243
1,"Friday Harbor Labs, Seattle, WA USA",1244
2,"Fritz Lipmann Inst, Jena, Germany",1245
3,"Fudan Univ, Shanghai, Peoples R China",1246
1,"Fujian Acad Forestry, Fuzhou, Peoples R China",1247
1,"Fujian Agr & Forestry Univ, Fuzhou, Peoples R China",1248
1,"Fujian Inst Oceanol, Fujian, Peoples R China",1249
1,"Fujian Prov Key Lab Marine Fishery Resources & Ec, Xiamen, Peoples R China",1250
3,"Fukuoka Univ, Fukuoka, Japan",1251
1,"Fukuoka Womens Univ, Fukuoka, Japan",1252
1,"Fukushima Prefectural Fisheries Expt Stn, Fukushima, Japan",1253
1,"Fukushima Univ, Fukushima, Japan",1254
1,"Fukuyama Univ, Hiroshima, Japan",1255
1,"Fundacao Oswaldo Cruz, Belo Horizonte MG, Brazil",1256
1,"Fundacao Oswaldo Cruz, Rio De Janeiro, Brazil",1257
1,"Fundacao Univ Fed Rio Grande, Rio Grande, Brazil",1258
1,"Fungal Biodivers Ctr, Utrecht, Netherlands",1259
1,"Gachon Univ, Incheon, South Korea",1260
1,"Gadjah Mada Univ, Sekip Yogyakarta, Indonesia",1261
1,"Gadjah Mada Univ, Yoguakarta, Indonesia",1262
1,"Gadjah Mada Univ, Yogvakarta, Indonesia",1263
15,"Gadjah Mada Univ, Yogyakarta, Indonesia",1264
1,"Gallipoli Barracks, Enoggera, Australia",1265
3,"Galway Mayo Inst Technol, Galway, Ireland",1266
7,"GAMET, Montpellier, France",1267
1,"Ganesha Univ Educ, Bali, Indonesia",1268
6,"Gangneung Wonju Natl Univ, Kangnung, South Korea",1269
1,"Gangwon Inst Hlth & Environm, Chunchon, South Korea",1270
1,"Gaviola Cpds, Cebu City, South Africa",1271
2,"Gazi Univ, Ankara, Turkey",1272
1,"GB Pant Univ, Uttar Pradesh, India",1273
1,"Genesis Biotechnol Sdn Bhd, Selangor, Malaysia",1274
1,"Genet Informat Res Inst, Los Altos, CA USA",1275
1,"Genie Microbiol & Enzymat, Montpellier, France",1276
1,"GenoCheck Co Ltd, Gyeonggi Do, South Korea",1277
1,"GenoMar AsA, Oslo, Norway",1278
2,"Genome Inst Singapore, Singapore, Singapore",1279
1,"Genoscope, Evry, France",1280
1,"GeoInformat Ctr Asian Inst Technol, Bangkok, Thailand",1281
1,"Geol Survey Malaysia, Kuching Sarawak, Malaysia",1282
1,"GEOMAR Helmholtz Ctr Ocean Res Kiel, Kiel, Germany",1283
1,"GEOMAR Helmholtz Ctr Ocean Res, Kiel, Germany",1284
1,"GEOMAR Helmholtz Zentrum Ozeanforsch Kiel, Kiel, Germany",1285
1,"GEOMAR, Kiel, Germany",1286
1,"Georg August Univ Gottingen, Gottingen, Germany",1287
1,"George Eliava Inst Bacteriophages Microbiol & Vir, Tbilisi, Rep of Georgia",1288
2,"George Mason Univ, Fairfax, VA USA",1289
2,"George Mason Univ, Manassas, VA USA",1290
3,"George Washington Univ, Washington, DC USA",1291
1,"Georgetown Univ, Washington, DC USA",1292
6,"Georgia Inst Technol, Atlanta, GA USA",1293
1,"Georgia Southern Univ, Statesboro, GA USA",1294
1,"Geospatial Hlth Journal, Brastad, Sweden",1295
1,"Germa Ctr Integrat Biodivers Res iDiv Halle Jena, Leipzig, Germany",1296
1,"German Ctr Integrat Biodivers Res iDiv, Leipzig, Germany",1297
2,"German Dev Serv DED, Makati, Philippines",1298
1,"Gesell Biotechnol Forsch GmbH, Braunschweig, Germany",1299
2,"Gesell Biotechnol Forsch mbH, Braunschweig, Germany",1300
1,"Ghent Univ, Ghent, Belgium",1301
6,"Gifu Univ, Gifu, Japan",1302
1,"GKSS Forschungszentrum Geesthacht GmbH, Geesthacht, Germany",1303
1,"Glami Lemi Biotechnol Res Ctr, Negeri Sembilan, Malaysia",1304
1,"Global Assoc People & Environm, Pakse, Laos",1305
1,"GnCBIO Co Ltd, Taejon, South Korea",1306
5,"Goa Univ, Goa, India",1307
5,"Goethe Univ Frankfurt, Frankfurt, Germany",1308
1,"Golden Crocodile Agr Thailand Co Ltd, Nakhon Pathom, Thailand",1309
2,"Gondol Res Inst Aquaculture, Bali, Indonesia",1310
1,"GONDOL RES INST COASTAL AQUACULTURE INDONESIA, BALI, INDONESIA",1311
1,"Gondol Res Inst Fisheries, Bali, Indonesia",1312
2,"Gondol Res Inst Mariculture GRIM, Bali, Indonesia",1313
2,"Gondol Res Inst Mariculture, Bali, Indonesia",1314
1,"Gondol Res Inst Mariculture, Indonesia, Indonesia",1315
2,"Gondol Res Stn Coastal Fisheries, Bali, Indonesia",1316
2,"Gondol Res Stn Coastal Fisheries, Singaraja, Indonesia",1317
1,"Gordon Coll, Wenham, MA USA",1318
2,"Gorgan Univ Agr Sci & Nat Resources, Gorgan, Iran",1319
1,"Gorgan Univ Agr Sci & Natural Resource, Gorgan, Iran",1320
1,"Gorgan Univ, Gorgan, Iran",1321
1,"Goteborgs Nat Hist Museum, Gothenburg, Sweden",1322
1,"Gothenburg Univ, Fiskebackskil, Sweden",1323
1,"Govt Aragon, Zaragoza, Spain",1324
1,"Govt Coll Madappally, Kozhikode, India",1325
2,"Govt Coll Univ, Faisalabad, Pakistan",1326
1,"Govt Coll Univ, Lahore, Pakistan",1327
1,"Govt Ctr, Tuguegarao City, Philippines",1328
1,"Govt India, Tamil Nadu, India",1329
1,"Govt Primary Hlth Ctr, Tamil Nadu, India",1330
1,"Govt Sindh, Jamshoro, Pakistan",1331
4,"Govt Sindh, Karachi, Pakistan",1332
2,"Govt Sindh, Sindh, Pakistan",1333
1,"Govt South Sulawesi Prov, Makassar, Indonesia",1334
1,"Govt Vet Off, Polonnaruwa, Sri Lanka",1335
3,"Govt Western Australia, WA, Australia",1336
1,"Grad Sch Agr & Life Sci, Tokyo, Japan",1337
1,"Grad Sch Agr Sci, Miyagi, Japan",1338
1,"Grad Univ, Okinawa, Japan",1339
1,"Grand Valley State Univ, Muskegon, MI USA",1340
1,"Graz Univ Technol, Graz, Austria",1341
2,"Great Barrier Reef Marine Pk Author, Qld, Australia",1342
1,"Griffith Univ, Gold Coast, Australia",1343
11,"Griffith Univ, Qld, Australia",1344
1,"Grigore Antipa Natl Museum Nat Hist, Bucharest, Romania",1345
1,"GRIM, Bali, Indonesia",1346
1,"Grunenthal GmbH, Aachen, Germany",1347
1,"Guangdong Acad Agr Sci, Guangzhou, Peoples R China",1348
2,"Guangdong Key Lab Control Dis Aquat Econ Anim, Zhanjiang, Peoples R China",1349
1,"Guangdong Ocean Univ GDOU, Guangdong, Peoples R China",1350
2,"Guangdong Ocean Univ, Guangdong, Peoples R China",1351
5,"Guangdong Ocean Univ, Zhanjiang, Peoples R China",1352
1,"Guangdong Ocen Univ, Zhanjiang, Peoples R China",1353
3,"Guangdong Prov Key Lab Pathogen Biol & Epidemiol, Zhanjiang, Peoples R China",1354
1,"Guangxi Acad Sci, Beihai, Peoples R China",1355
2,"Guangxi Acad Sci, Nanning, Peoples R China",1356
1,"Guangxi Ctr Dis Prevent & Control, Guangxi, Peoples R China",1357
1,"Guangxi Mangrove Res Ctr, Beihai, Peoples R China",1358
2,"Guangxi Univ, Guangxi, Peoples R China",1359
1,"Guangxi Univ, Nanning, Peoples R China",1360
1,"Guangzhou Entry Exit Inspect & Quarantine, Guangdong, Peoples R China",1361
1,"Guide Tours Ltd, Dhaka, Bangladesh",1362
1,"Guilin Med Univ, Guilin, Peoples R China",1363
1,"Guilin Univ Technol, Guilin, Peoples R China",1364
7,"Guizhou Acad Agr Sci, Guizhou, Peoples R China",1365
2,"Guizhou Univ, Guiyang, Peoples R China",1366
1,"Guizhou Univ, Guizhou Prov, Peoples R China",1367
2,"Guizhou Univ, Guizhou Provinc, Peoples R China",1368
4,"Guizhou Univ, Guizhou, Peoples R China",1369
1,"Gyeongbuk Inst Bioind, Gyeongbuk, South Korea",1370
1,"Gyeongnam Natl Univ Sci & Technol, Jinju, South Korea",1371
2,"Gyeongsang Natl Univ Sch Med, Jinju, South Korea",1372
3,"Gyeongsang Natl Univ, Chinju, South Korea",1373
1,"Gyeongsang Natl Univ, Gyeongnam, South Korea",1374
17,"Gyeongsang Natl Univ, Jinju, South Korea",1375
1,"Gyeongsang Natl Univ, Tongyeong, South Korea",1376
1,"Haad Chao Samram, Petchaburi, Thailand",1377
2,"Hacettepe Univ, Ankara, Turkey",1378
1,"Haereticus Environm Lab, Clifford, VA USA",1379
1,"Hagerman Fish Culture Res Lab, Hagerman, ID USA",1380
1,"Hai Phong Inst Oceanol, Haiphong City, Vietnam",1381
1,"Haikou Key Lab Environm Toxicol, Haikou, Peoples R China",1382
1,"Hainan Prov Fisheries Res Inst, Hainan, Peoples R China",1383
19,"Hainan Univ, Haikou, Peoples R China",1384
3,"Hainan Univ, Hainan, Peoples R China",1385
1,"Haitian Univ, Haikou, Peoples R China",1386
1,"Haluoleo Univ, Kendari, Indonesia",1387
1,"Haluoleo Univ, Sulawesi Tengga, Indonesia",1388
1,"Haluoleo Univ, Sulawesi Tenggara, Indonesia",1389
4,"Hamamatsu Univ Sch Med, Shizuoka, Japan",1390
1,"Hamamatsu Univ, Shizuoka, Japan",1391
1,"Hang Tuah Univ, Surabaya, Indonesia",1392
1,"Hangzhou Acad Agr Sci, Zhejiang, Peoples R China",1393
2,"Hangzhou Normal Univ, Zhejiang, Peoples R China",1394
1,"Hannam Univ, Daejeon, South Korea",1395
2,"Hannam Univ, Taejon, South Korea",1396
1,"Hanoi Agr Univ, Hanoi, Vietnam",1397
10,"Hanoi Med Univ, Hanoi, Vietnam",1398
1,"Hanoi Metropolitan Univ, Hanoi, Vietnam",1399
5,"Hanoi Natl Univ Educ, Hanoi, Vietnam",1400
1,"Hanoi Sch Publ Hlth, Hanoi, Vietnam",1401
1,"Hanoi Univ Agr, Hanoi, Vietnam",1402
1,"Hanoi Univ Educ, Hanoi, Vietnam",1403
3,"Hanoi Univ Min & Geol, Hanoi, Vietnam",1404
1,"Hanoi Univ Pharm, Hanoi, Vietnam",1405
1,"Hanoi Univ Publ Hlth, Hanoi, Vietnam",1406
5,"Hanoi Univ Sci & Technol, Hanoi, Vietnam",1407
3,"Hanoi Univ Sci, Hanoi, Vietnam",1408
2,"Hanoi Univ Technol, Hanoi, Vietnam",1409
4,"Hanover Coll, Hanover, IN USA",1410
1,"Hans Knoell Inst, Jena, Germany",1411
1,"Hans Knoll Inst Nat Forschung, Jena, Germany",1412
1,"Hanyang Univ, Gyeonggi Do, South Korea",1413
7,"Hanyang Univ, Seoul, South Korea",1414
1,"HARBOR BRANCH OCEANOG INST INC, FT PIERCE, FL USA",1415
1,"Harbour Aquaculture Consultancy Serv Ltd, Coxs Bazar, Bangladesh",1416
1,"Harbour Hosp, Rotterdam, Netherlands",1417
1,"Harding Univ, Searcy, AR USA",1418
1,"Haribon Fdn Conservat Nat Resources, Cebu, Philippines",1419
1,"Haribon Fdn, Quezon City, Philippines",1420
2,"Harrisvaccines Inc, Ames, IA USA",1421
1,"Harvard Med Sch, Boston, MA USA",1422
3,"Harvard Univ, Boston, MA USA",1423
6,"Harvard Univ, Cambridge, MA USA",1424
1,"Harvest Select Farms, Inverness, MS USA",1425
2,"Harvey Mudd Coll, Claremont, CA USA",1426
2,"HAS, Budapest, Hungary",1427
25,"Hasanuddin Univ, Makassar, Indonesia",1428
1,"Hasanuddin Univ, South Sulawesi, Indonesia",1429
1,"Hasanuddin Univ, Ujung Pandang, Indonesia",1430
2,"Hat Yai Hosp, Hat Yai, Thailand",1431
1,"Hatyai Univ, Songkhla, Thailand",1432
1,"Hawaiian Isl Humpback Whale Natl Marine Sanctuary, Kihei, HI USA",1433
1,"Hebrew Univ Jerusalem, Jerusalem, Israel",1434
1,"Hebrew Univ Jerusalem, Rehovot, Israel",1435
2,"Heidelberg Univ, Heidelberg, Germany",1436
1,"Heilongjiang Bayi Agr Univ, Heilongjiang Pr, Peoples R China",1437
1,"Hellen Ctr Marine Res, Anavyssos, Greece",1438
1,"Hellen Ctr Marine Res, Attica, Greece",1439
1,"Hellen Ctr Marine Res, Crete, Greece",1440
1,"Hellen Ctr Marine Res, Rhodes, Greece",1441
1,"HELLEN KELLER INT, W JAVA, INDONESIA",1442
1,"Hellen Ornithol Soc, Athens, Greece",1443
1,"Hellenic Ctr Marine Res, Iraklion, Greece",1444
1,"Helmhoitz Ctr Environm Res UFZ, Leipzig, Germany",1445
1,"Helmholtz Ctr Environm Res, Halle, Germany",1446
2,"Helmholtz Ctr Infect Res, Braunschweig, Germany",1447
1,"Helmholtz Ctr Polar & Marine Res, Bremerhaven, Germany",1448
1,"Henan Eye Hosp, Henan, Peoples R China",1449
1,"Henan Eye Inst, Henan, Peoples R China",1450
1,"Henan Prov Peoples Hosp, Henan, Peoples R China",1451
1,"Herbario Univ Caldas FAUC, Caldas, Colombia",1452
1,"Heriot Watt Univ, Midlothian, Scotland",1453
1,"High Inst Hlth Sci North CESPU, Gandra, Portugal",1454
1,"High Sch Environm Studies, New York, NY USA",1455
3,"Himachal Pradesh Agr Univ, Himachal Prades, India",1456
1,"Himeji Inst Technol, Hyogo, Japan",1457
13,"Hirosaki Univ, Aomori, Japan",1458
1,"Hirosaki Univ, Newton, TX USA",1459
1,"Hiroshima Inst Technol, Hiroshima, Japan",1460
1,"Hiroshima Prefectural Technol Res Inst, Hiroshima, Japan",1461
21,"Hiroshima Univ, Higashihiroshima, Japan",1462
19,"Hiroshima Univ, Hiroshima, Japan",1463
1,"Hiroshima Univ, Takehara, Japan",1464
1,"Hitachi Instruments Serv Co Ltd, Tokyo, Japan",1465
1,"Hlth Effects Inst, Boston, MA USA",1466
1,"Hlth Sci Univ Hokkaido, Hokkaido, Japan",1467
1,"Hlth Sci Univ, Mongolia, Peoples R China",1468
1,"Hlth, Northern Samar, Philippines",1469
1,"Ho Chi Minh City Univ Food Ind, Ho Chi Minh City, Vietnam",1470
1,"Ho Chi Minh City Univ Technol, Ho Chi Minh City, Vietnam",1471
1,"Ho Chi Minh Univ Technol, Ho Chi Minh City, Vietnam",1472
1,"Hoa Binh Prov Gen Hosp, Hoa Binh, Vietnam",1473
1,"Hochiminh City Int Univ, Ho Chi Minh City, Vietnam",1474
1,"HoChiMinh City Univ Technol, Ho Chi Minh City, Vietnam",1475
4,"Hofstra Univ, Hempstead, NY USA",1476
1,"Hokkaido Cent Fisheries Expt Stn, Hokkaido, Japan",1477
1,"Hokkaido Ind Technol Ctr, Hokkaido, Japan",1478
1,"Hokkaido Inst Publ Hlth, Hokkaido, Japan",1479
1,"Hokkaido Natl Fisheries Res Inst, Kushiro, Japan",1480
1,"Hokkaido Res Ctr, Hokkaido, Japan",1481
1,"Hokkaido Univ Museum, Hokkaido, Japan",1482
54,"Hokkaido Univ, Hokkaido, Japan",1483
1,"Holden Arboretum, Kirtland, OH USA",1484
1,"Holetta Agr Res Ctr, Addis Ababa, Ethiopia",1485
1,"Hong Kong Baptist Univ, Hong Kong, Peoples R China",1486
1,"Hong Kong Cetacean Res Project, Hong Kong, Peoples R China",1487
3,"Hong Kong Polytech Univ, Hong Kong, Peoples R China",1488
1,"Hong Kong PolyU Shenzhen Res Inst, Shenzhen, Peoples R China",1489
3,"Hong Kong Univ Sci & Technol, Hong Kong, Peoples R China",1490
1,"Hong Kong Univ Sci & Technol, Kowloon, Hong Kong",1491
1,"Hongze Lake Fisheries Management Comm Off, Huaian, Peoples R China",1492
1,"Hop Faune Sauvage Garrigues & Cevennes Clin Vet, Ganges, France",1493
1,"Hop La Pitie Salpetriere, Paris, France",1494
1,"Hormozgan Univ, Bandar Abbas, Iran",1495
1,"Horniman Museum & Gardens, London, England",1496
1,"Hosanuddin Univ, Makassar, Indonesia",1497
2,"Hosp Ampang, Selangor, Malaysia",1498
1,"Hosp Espanol Mexico, Jalisco, Mexico",1499
1,"Hosp Raja Perempuan Zainab II, Kelantan, Malaysia",1500
1,"Hosp Reg Puerto Montt, Puerto Montt, Chile",1501
1,"Hosp Selayang, Selangor, Malaysia",1502
1,"Hosp Sick Children, Toronto ON, Canada",1503
1,"Hosp Trop Dis, Ho Chi Quan, Vietnam",1504
1,"Housing & Dev Board, Singapore, Singapore",1505
2,"Howard Univ, Washington, DC USA",1506
1,"Hpa An Univ, Kayin State, Myanmar",1507
1,"Huachiew Chalermprakiet Univ, Samut Prakan, Thailand",1508
1,"Huaihai Inst Technol, Lianyungang, Peoples R China",1509
1,"Huainan Normal Univ, Huainan, Peoples R China",1510
1,"Huaiyin Normal Univ, Huaian, Peoples R China",1511
2,"Huazhong Agr Univ, Hubei, Peoples R China",1512
5,"Huazhong Agr Univ, Wuhan, Peoples R China",1513
1,"Huazhong Univ Sci & Technol, Wuhan, Peoples R China",1514
2,"Hue Univ Agr & Forestry, Hue City, Vietnam",1515
1,"Hue Univ Med & Pharm, Hue, Vietnam",1516
2,"Hue Univ Pharm & Med, Hue, Vietnam",1517
1,"Humane Soc Int, Washington, DC USA",1518
1,"Humboldt State Univ, Arcata, CA USA",1519
5,"Humboldt Univ, Berlin, Germany",1520
2,"Hunan Agr Univ, Hunan, Peoples R China",1521
1,"Hunan Fisheries Sci Inst, Hunan, Peoples R China",1522
1,"Hunan Univ Chinese Med, Hunan, Peoples R China",1523
3,"Hungarian Acad Sci, Budapest, Hungary",1524
1,"Huzhou Cent Hosp, Zhejiang, Peoples R China",1525
1,"HW Fish Hlth Lab, Tokyo, Japan",1526
1,"Hybrid Catfish Co, Inverness, MS USA",1527
1,"Hydra Enterprises Ltd, Vancouver BC, Canada",1528
1,"Hyogo Prefectural Inst Publ Hlth & Environm Sci, Hyogo, Japan",1529
1,"I Guana Farm, Cedaredge, CO USA",1530
1,"I Shou Univ, Kaohsiung, Taiwan",1531
1,"IAI GIRLS HIGH SCH, HOKKAIDO, JAPAN",1532
2,"Ibaraki Univ, Ibaraki, Japan",1533
1,"IBB Univ, Niger State, Nigeria",1534
1,"IBM Almaden Res Ctr, San Jose, CA USA",1535
1,"Ibrahim Badamasi Babangida IBB Univ, Lapai, Nigeria",1536
1,"Ibrahim Badamasi Babangida IBB Univ, Niger State, Niger",1537
1,"IBRC, Tehran, Iran",1538
1,"ICABIOGRAD AARD, Bogor, Indonesia",1539
1,"ICAR Cent Inland Fisheries Res Inst, Kolkata, India",1540
1,"ICAR Cent Inst Freshwater Aquaculture, Odisha, India",1541
1,"ICAR Cent Marine Fisheries Res Inst, Andhra Pradesh, India",1542
1,"ICAR, Uttar Pradesh, India",1543
2,"Icddr B, Dhaka, Bangladesh",1544
2,"Icddrb, Dhaka, Bangladesh",1545
1,"ICETA, Vila Do Conde, Portugal",1546
2,"ICLARM, George Town, Malaysia",1547
1,"ICLARM, Makati City, Philippines",1548
1,"ICNET Ltd, Saitama, Japan",1549
1,"ICVS 3Bs, Guimaraes, Portugal",1550
1,"Idaho State Univ, Pocatello, ID USA",1551
1,"IFAPA, Cadiz, Spain",1552
1,"IFREMER Delegat Reunion, Le Port, France",1553
1,"Ifremer, Argenton, France",1554
1,"IFREMER, Boulogne, France",1555
1,"IFREMER, Le Port, Reunion",1556
1,"IFREMER, Lhoumeau, France",1557
1,"IFREMER, Montpellier, France",1558
1,"IFREMER, Nantes, France",1559
1,"IFREMER, Noumea, New Caledonia",1560
2,"IFREMER, Palavas Les Flots, France",1561
1,"IFREMER, Port En Bessin, France",1562
4,"IFRO, Tehran, Iran",1563
1,"IFRP, Tehran, Iran",1564
3,"IIUM, Pahang Darul Ma, Malaysia",1565
1,"IIUM, Pahang, Malaysia",1566
1,"Ilam Univ Med Sci, Ilam, Iran",1567
1,"Iloilo State Coll Fisheries, Iloilo, Philippines",1568
1,"IMARES Inst Marine Resources & Ecosyst Studies, Den Helder, Netherlands",1569
1,"Imperial Coll Fac Med, London W2 1PG, England",1570
1,"Imperial Coll London, London, England",1571
1,"Imperial Household Agcy, Tokyo, Japan",1572
1,"Imperial Residence, Tokyo, Japan",1573
1,"IMROP Cansado, Nouadhibou, Mauritania",1574
2,"Indian Agr Res Inst, New Delhi, India",1575
1,"Indian Council Agr Res, Tamil Nadu, India",1576
2,"Indian Inst Chem Technol, Andhra Pradesh, India",1577
