records,locations,id
1,"AAHL, Vic, Australia",1
1,"AAHRI, Bangkok, Thailand",2
1,"Aarhus Univ Biosci, Roskilde, Denmark",3
1,"Aarhus Univ Hosp, Aarhus, Denmark",4
13,"Aarhus Univ, Aarhus C, Denmark",5
3,"Aarhus Univ, Aarhus, Denmark",6
1,"Abasyn Univ, Peshawar, Pakistan",7
1,"Abdul Wali Khan Univ, Mardan, Pakistan",8
1,"Abertay Univ, Dundee DD1 1HG, Scotland",9
1,"Aberystwyth Univ, Ceredigion, Wales",10
2,"Aberystwyth Univ, Dyfed, Wales",11
1,"Abo Akad Univ, Turku, Finland",12
1,"ABRII, Karaj, Iran",13
1,"Absyn Univ Peshawar, Peshawar, Pakistan",14
1,"Acad Ciencias Cuba, C Habana, Cuba",15
4,"Acad Nat Sci Philadelphia, Philadelphia, PA USA",16
4,"Acad Sci Czech Republ, Ceske Budejovice, Czech Republic",17
1,"Acad Sci Czech Republic, Brno, Czech Republic",18
7,"Acad Sci Czech Republic, Ceske Budejovice, Czech Republic",19
2,"Acad Sci Czech Republic, Prague, Czech Republic",20
1,"Acad Sci, Pruhonice, Czech Republic",21
1,"Acad Sinica, Beijing, Peoples R China",22
35,"Acad Sinica, Taipei, Taiwan",23
1,"Acadian Seaplants Ltd, Dartmouth NS, Canada",24
1,"Acharya Nagarjuna Univ, Andhra Pradesh, India",25
1,"Achva Acad Coll, Achva, Israel",26
3,"Achva Acad Coll, Mobile Post Shikmim, Israel",27
1,"Acopian Ctr Conservat Learning, Orwigsburg, PA USA",28
1,"Acquario Genova, Genoa, Italy",29
2,"Adam Mickiewicz Univ, Poznan, Poland",30
1,"ADAS UK Ltd, Cambs, England",31
1,"Adm Bur Zhanjiang Mangrove Natl Nat Reserve ZMNNR, Guangdong, Peoples R China",32
1,"Adnan Menderes Univ, Aydin, Turkey",33
1,"Adv BioNutr Corp, Columbia, MD USA",34
1,"Adv Choice Econ Pty Ltd, Bateman, Australia",35
1,"Adventist Univ Philippines, Silang, Philippines",36
1,"Afil Aqua Fish Ltd, Jessore, Bangladesh",37
2,"Africa Museum, Tervuren, Belgium",38
1,"African Conservat Ctr, Nairobi, Kenya",39
1,"AFRIMS Entomol Lab, Kamphaeng Phet, Thailand",40
1,"Agcy Assessment & Applicat Technol BPPPT, Jakarta, Indonesia",41
1,"Agcy Consultat & Res Oceanog, La Roche Canillac, France",42
1,"Agcy Marine & Fisheries Res Indonesia, Jakarta, Indonesia",43
3,"Agcy Marine & Fisheries Res, Jakarta, Indonesia",44
1,"Agcy Sci Technol & Res, Biopolis, Singapore",45
2,"Agcy Sci Technol & Res, Singapore, Singapore",46
1,"Agencia Paulista Tecnol Agronegocios, Piracicaba SP, Brazil",47
1,"Agilent Technol UK Ltd, Yarnton, England",48
1,"Agilent Technol, Bangkok, Thailand",49
1,"Agilent Technol, Santa Clara, CA USA",50
1,"Agr & Agri Food Canada, Ottawa ON, Canada",51
2,"Agr Biotechnol Ctr, Godollo, Hungary",52
1,"Agr Biotechnol Res Inst Iran ABRII, Karaj, Iran",53
1,"Agr Dept Zhejiang Prov, Zhejiang, Peoples R China",54
1,"Agr Food & Vet Author Singapore, Singapore, Singapore",55
1,"Agr Food & Vet Author, Singapore, Singapore",56
1,"Agr Res Council, Hilton, South Africa",57
1,"Agr Res Ctr, Giza, Egypt",58
1,"Agr Res Ctr, Sabah, Malaysia",59
1,"Agr Res Educ & Extens Org, Bandar Abass, Iran",60
2,"Agr Res Org, Bet Dagan, Israel",61
1,"Agr Res Serv, University, MS USA",62
1,"Agr Training Inst, Faridpur, Bangladesh",63
1,"AGR UNIV MALAYSIA, SELANGOR, MALAYSIA",64
1,"Agr Univ Szczecin, Szczecin, Poland",65
1,"Agri Food & Vet Author AVA, Singapore, Singapore",66
2,"Agri Food & Vet Author Singapore, Singapore, Singapore",67
1,"Agri Food & Vet Author, Singapore, Singapore",68
1,"Agrifood & Biosci Inst, Antrim, North Ireland",69
3,"Agrifood & Vet Author Singapore, Singapore, Singapore",70
2,"Agrifood & Vet Author, Singapore, Singapore",71
1,"Agrocalidad, Guayaquil, Ecuador",72
1,"Agrocampus Rennes, Rennes, France",73
1,"AgroParisTech, Paris, France",74
2,"Agroscope Changins Wadenswil Res Stn ACW, Nyon, Switzerland",75
1,"Ahi Evran Univ, Kirsehir, Turkey",76
5,"Aichi Gakuin Univ, Aichi, Japan",77
3,"Aichi Konan Coll, Aichi, Japan",78
1,"Aichi Med Univ, Aichi, Japan",79
1,"Aichi Prefectural Food Inspect Ctr, Aichi, Japan",80
4,"AIMST Univ, Kedah Darul Ama, Malaysia",81
12,"AIMST Univ, Kedah, Malaysia",82
3,"Ain Shams Univ, Cairo, Egypt",83
1,"Airlangga Sch Med, Surabaya, Indonesia",84
9,"Airlangga Univ, Surabaya, Indonesia",85
1,"AIST, Ibaraki, Japan",86
1,"AIT, Pathum Thani, Thailand",87
1,"AIT, Pathumthani, Thailand",88
1,"Aix Marseille Univ, Aix En Provence, France",89
1,"Aix Marseille Univ, Marseille, France",90
3,"Ajinomoto Co Inc, Kanagawa, Japan",91
1,"Ajou Univ, Suwon, South Korea",92
1,"Akajima Marine Sci Lab, Okinawa, Japan",93
1,"Akajima Marine Stn Lab, Okinawa, Japan",94
1,"Akita Prefectural Univ, Akita, Japan",95
1,"Akita Prefectural Univ, Minami, Japan",96
1,"Akita Res Ctr Publ Hlth & Environm, Akita, Japan",97
1,"Akita Univ, Akita, Japan",98
1,"Akvaforsk Genet Ctr AS, Sunndalsora, Norway",99
1,"AKVAFORSK, As, Norway",100
1,"Al Azhar Univ, Assiut, Egypt",101
1,"Al Baha Univ, Al Baha, Saudi Arabia",102
1,"Al Nahrain Univ, Baghdad, Iraq",103
1,"Al Shiba Vet Hosp, Dubai, U Arab Emirates",104
1,"Al Zahra Univ Tehran, Tehran, Iran",105
1,"Al Zaytoonah Univ Jordan, Amman, Jordan",106
3,"Alagappa Univ, Tamil Nadu, India",107
1,"Alaska Dept Fish & Game, Douglas, AK USA",108
1,"Alaska Dept Fish & Game, Petersburgh, AK USA",109
1,"Alexandru Ioan Cuza Univ, Iasi, Romania",110
8,"Alfred Wegener Inst Polar & Marine Res, Bremerhaven, Germany",111
1,"Alfred Wegener Inst Polar & Marine Res, Heligoland, Germany",112
4,"Alfred Wegener Inst Polar & Marine Res, List Auf Sylt, Germany",113
1,"Aligarh Muslim Univ, Uttar Pradesh, India",114
1,"All India Inst Hyg & Publ Hlth, Kolkata, India",115
1,"Alltech Asia Pacific Biosci Ctr, Pathumthani, Thailand",116
2,"ALVALAB, Santander, Spain",117
1,"AlZaytoonah Univ Jordan, Amman, Jordan",118
1,"Amagasaki Kita Senior High Sch, Hyogo, Japan",119
1,"Amagasaki Senior High Sch, Hyogo, Japan",120
6,"AMB Circolo Micol Giovanni Carini, Brescia, Italy",121
1,"AMB Circolo Micologico Giovanni Carini, Brescia, Italy",122
8,"AMB Grp Micol Forlivese Antonio Cicognani, Forli, Italy",123
1,"AMB Gruppo Micol Forlivese Antonio Cicognani, Forli, Italy",124
1,"AMB, Forli, Italy",125
1,"AMBL Kyushu Univ, Kumamoto, Japan",126
1,"Amedeo Avogadro Univ, Novara, Italy",127
1,"Amer Embassy, Tokyo, Japan",128
7,"Amer Museum Nat Hist, New York, NY USA",129
1,"Amer Samoa Dept Marine & Wildlife Resources, Pago Pago, AS USA",130
1,"Amer Univ Beirut, Beirut, Lebanon",131
2,"Amer Univ Cairo, New Cairo, Egypt",132
1,"AMFRD Ctr Aquaculture Res & Dev, Jakarta, Indonesia",133
2,"Amgueddfa Cymru Natl Museum Wales, S Glam, Wales",134
1,"Amnatcharoen Hosp, Amnat Charoen, Thailand",135
1,"Amnatcharoen Hosp, Amnatcharoen, Thailand",136
3,"AN Severtsov Inst Ecol & Evolut, Moscow, Russia",137
1,"AN Severtzov Inst Ecol & Evolut RAS, Moscow, Russia",138
1,"AN Severtzov Inst Ecol & Evolut, Moscow, Russia",139
2,"ANABIO Res & Dev JSC, Hanoi, Vietnam",140
1,"Anandaban Hosp, Kathmandu, Nepal",141
1,"Andalas Univ, Padang W Sumatra, Indonesia",142
3,"Andalas Univ, Padang, Indonesia",143
2,"Andalas Univ, W Sumatra, Indonesia",144
2,"Andaman Sea Fisheries Dev Ctr, Phuket, Thailand",145
2,"Andaman Sea Fisheries Res & Dev Ctr, Phuket, Thailand",146
3,"Andhra Univ, Andhra Pradesh, India",147
1,"Angeles Univ Fdn, Angeles City, Philippines",148
1,"Anglo Chinese Jr Coll, Singapore, Singapore",149
1,"Anhui Agr Univ, Anhui, Peoples R China",150
1,"Anhui Normal Univ, Wuhu, Peoples R China",151
1,"Anhui Univ Sci & Technol, Huainan, Peoples R China",152
2,"Anhui Univ, Hefei, Peoples R China",153
1,"Anim & Fisheries Sci Univ, Karnataka, India",154
1,"Anim Hlth Res Inst, Tanshui, Taiwan",155
1,"Anna Univ, Tamil Nadu, India",156
1,"Annamalai Univ, Parangipettai, India",157
11,"Annamalai Univ, Tamil Nadu, India",158
1,"Antananarivo Univ, Antananarivo, Madagascar",159
1,"Aomori Ake No Hoshi Senior High Sch, Aomori, Japan",160
2,"Aomori Prefectural Agr & Forestry Res Ctr, Aomori, Japan",161
1,"APEX Environm Pty Ltd, Bali, Indonesia",162
1,"APTA, Monte Alegre Do Sul SP, Brazil",163
1,"APTA, Pindamonhangaba SP, Brazil",164
1,"APTA, Sao Paulo, Brazil",165
1,"AQD, Iloilo, Philippines",166
1,"Aqua Lab AS, Bergen, Norway",167
1,"Aquaculture Fdn India, Tamil Nadu, India",168
1,"Aquafin CRC, SA, Australia",169
1,"Aquafin CRC, Tas, Australia",170
1,"AquaSolut Biotech, Malaga, Spain",171
1,"Aquat Anim Biotechnol Res Ctr, Surat Thani, Thailand",172
4,"Aquat Anim Hlth Res Inst, Bangkok, Thailand",173
1,"Aquat Biodivers Associates, Eureka, CA USA",174
1,"Aquat Dis Ctr, Samutsakorn, Thailand",175
1,"Aranzadi Soc Sci, Donostia San Sebastian, Spain",176
1,"ARC Inst Trop & Subtrop Crops, Nelspruit, South Africa",177
1,"ARC PPRI, Hilton, South Africa",178
1,"ARC PPRI, Kwazulu Natal, South Africa",179
1,"ARC, Queenswood, South Africa",180
1,"ARC, Stellenbosch, South Africa",181
1,"Archipelagos Inst Marine Conservat, Samos, Greece",182
1,"Area Marina Protetta Isola di Bergeggi, Savona, Italy",183
1,"Ariadne Genom, Rockville, MD USA",184
1,"Aristotle Univ Thessaloniki, Macedonia, Greece",185
2,"Aristotle Univ Thessaloniki, Thessaloniki, Greece",186
2,"Arizona State Univ, Tempe, AZ USA",187
5,"Armed Forces Res Inst Med Sci, Bangkok, Thailand",188
1,"ARMY GEN HOSP, TAUYUAN, TAIWAN",189
1,"Army Inst Pathol, Bangkok, Thailand",190
1,"Aromagen, Albany, OR USA",191
1,"ARS, Beltsville, MD USA",192
1,"ARS, Florence, SC USA",193
1,"ARS, Ft Lauderdale, FL USA",194
1,"ARS, Newark, DE USA",195
8,"ARS, Peoria, IL USA",196
2,"ARS, Poplarville, MS USA",197
1,"ARS, Salinas, CA USA",198
3,"ARS, Stoneville, MS USA",199
1,"ARS, Washington, DC USA",200
1,"ART Biol, Ames, IA USA",201
1,"Artemia Ref Ctr, Ghent, Belgium",202
2,"Artoo Marine Biol Consultants, Hants, England",203
4,"Asahikawa Med Coll, Hokkaido, Japan",204
1,"Asahikawa Med Univ, Hokkaido, Japan",205
1,"Asaian Bat Res Inst, Okinawa, Japan",206
1,"Ascofrance, Villiers En Bois, France",207
1,"Ashoka Trust Res Ecol & Environm ATREE, Karnataka, India",208
1,"Ashoka Trust Res Ecol & Environm, Karnataka, India",209
1,"Asian Inst Med Sci & Technol, Kedah, Malaysia",210
6,"Asian Inst Technol, Bangkok, Thailand",211
1,"Asian Inst Technol, Klong Luang, Thailand",212
1,"Asian Inst Technol, Klongluang, Thailand",213
14,"Asian Inst Technol, Pathum Thani, Thailand",214
16,"Asian Inst Technol, Pathumthani, Thailand",215
1,"Asian Inst Technol, Pathunthani, Thailand",216
1,"Asian Inst Technol, Thani, Thailand",217
1,"ASIAN PACIFIC REG RES & TRAINING CTR, WUXI, PEOPLES R CHINA",218
1,"Assam Agr Univ, Assam, India",219
3,"Assiut Univ, Assiut, Egypt",220
1,"Assoc Conservat Malacol, Kanagawa, Japan",221
1,"Assoc Marine Explorat, Kailua, HI USA",222
2,"Assumption Univ, Bangkok, Thailand",223
1,"ASTAR, Proteos, Singapore",224
13,"ASTAR, Singapore, Singapore",225
1,"Astron Rech Dev, Noumea, New Caledonia",226
1,"Ateneo Manila Univ, Manila, Philippines",227
3,"Ateneo Manila Univ, Metro Manila, Philippines",228
9,"Ateneo Manila Univ, Quezon City, Philippines",229
1,"Atheris Labs, Bernex, Switzerland",230
1,"Atheris Labs, Geneva, Switzerland",231
1,"Atlas Pacific Ltd PT, Denpasar, Indonesia",232
1,"Atlas Pacific S Sea Pearls PT Cendana Indopearls, Bali, Indonesia",233
2,"Atlas Pearls & Perfumes, Bali, Indonesia",234
1,"ATLAS PRAWN CORP, CEBU, PHILIPPINES",235
1,"Atlas S Sea Pearl Ltd, Denpasar, Indonesia",236
1,"Atlas S Sea Pearl Ltd, WA, Australia",237
1,"Atlas S Sea Pearl, Denpasar, Indonesia",238
1,"Atlas S Sea Pearl, WA, Australia",239
1,"Atom Energy Ctr, Dhaka, Bangladesh",240
1,"Att Lab, Miyagi, Japan",241
13,"Auburn Univ, Auburn, AL USA",242
1,"Auckland Mail Ctr, Auckland, New Zealand",243
3,"Auckland Univ Technol, Auckland, New Zealand",244
1,"Aussian Vietnamese Trop Ctr, Nha Trang, Vietnam",245
1,"Australia & Adv Choice Econ Ply Ltd, WA, Australia",246
1,"Australian Army Malaria Inst, Enoggera, Australia",247
4,"Australian Army Malaria Inst, Qld, Australia",248
1,"Australian Catholic Univ, NSW, Australia",249
25,"Australian Inst Marine Sci, Qld, Australia",250
1,"Australian Inst Marine Sci, WA, Australia",251
2,"Australian Museum Res Inst, NSW, Australia",252
27,"Australian Museum, NSW, Australia",253
8,"Australian Natl Univ, ACT, Australia",254
1,"Austrian Inst Technol GmbH, Vienna, Austria",255
3,"AusVet Anim Hlth Serv, Qld, Australia",256
1,"Author Protect & Management Angkor & Reg Siem Rea, Siem Reap, Cambodia",257
1,"Autonomous Reg Muslim Mindanao, Cotabato City, Philippines",258
1,"Autonomous Univ Sinaloa, Sinaloa, Mexico",259
2,"Azabu Univ, Kanagawa, Japan",260
1,"Azad Housing Soc, Curca, India",261
3,"Azad Housing Soc, Goa Velha, India",262
1,"Bac Lieu Expt Stn Aquaculture, Bac Lieu Provin, Vietnam",263
1,"Badan Pengkajian & Penerapan Teknol, Jakarta, Indonesia",264
1,"Bahir Dar Univ, Bahir Dar, Ethiopia",265
1,"Balai Litbang P2B2 Donggala Badan Litbangkes, Sulawesi Tengah, Indonesia",266
1,"BALAI PENELITIAN BUDIDAYA PANTAI, SULAWESI SELATA, INDONESIA",267
1,"BALAI PENELITIAN VET, W JAVA, INDONESIA",268
1,"Baldersdale, Durham, England",269
1,"Bali & Nusa Tenggara Reg Off, Denpasar, Indonesia",270
1,"Balitbang Zool, Bogor, Indonesia",271
2,"Ball State Univ, Muncie, IN USA",272
1,"Balt Sea Res Inst Warnemunde, Rostock, Germany",273
2,"BALYENA ORG, Bohol, Philippines",274
1,"Bamrasnaradura Infect Dis Hosp, Nonthaburi, Thailand",275
1,"Bamrasnardura Hosp, Nonthaburi, Thailand",276
1,"Banaras Hindu Univ, Uttar Pradesh, India",277
2,"Bandung Inst Technol, Bandung, Indonesia",278
1,"Bandung Inst Technol, W Java, Indonesia",279
1,"Bangladesh & South Asia Off, Dhaka, Bangladesh",280
10,"Bangladesh Agr Univ, Mymensingh, Bangladesh",281
1,"Bangladesh Atom Energy Res Estab, Dhaka, Bangladesh",282
1,"Bangladesh Cetacean Divers Project, Khulna, Bangladesh",283
1,"Bangladesh Fisheries Res Inst Freshwater Stn, Mymensingh, Bangladesh",284
1,"Bangladesh Fisheries Res Inst, Bagerhat, Bangladesh",285
2,"Bangladesh Fisheries Res Inst, Mymensingh, Bangladesh",286
1,"Bangladesh Rice Res Inst, Gazipur, Bangladesh",287
1,"Bangor Univ Menai Bridge, Anglesey LL59 SAB, Wales",288
3,"Bangor Univ, Gwynedd, Wales",289
2,"Bansomdejchaopraya Rajabhat Univ, Bangkok, Thailand",290
1,"Bappeda NTT, Kupang, Indonesia",291
1,"Barapa Univ, Chanthaburi, Thailand",292
1,"Bavarian Hlth & Food Safety Author, Oberschleissheim, Germany",293
2,"Bavarian State Collect Palaeontol & Geol, Munich, Germany",294
1,"Bavarian State Collect Zool, Munich, Germany",295
1,"Bavarian State Res Ctr Agr, Freising Weihenstephan, Germany",296
1,"Bayer CropSci, Ghent, Belgium",297
1,"Bedford Inst Oceanog, Dartmouth NS, Canada",298
6,"Beijing Acad Agr & Forestry Sci, Beijing, Peoples R China",299
1,"Beijing Childrens Hosp, Beijing, Peoples R China",300
5,"Beijing Forestry Univ, Beijing, Peoples R China",301
3,"Beijing Genom Inst, Shenzhen, Peoples R China",302
1,"Beijing Kemufeng Biopharmaceut Co, Beijing, Peoples R China",303
2,"Beijing Nat Hist Museum, Beijing, Peoples R China",304
3,"Beijing Normal Univ, Beijing, Peoples R China",305
1,"Beijing Univ Chem Technol, Beijing, Peoples R China",306
1,"Beilun Peoples Hosp, Zhejiang, Peoples R China",307
1,"Bellairs Res Inst, St James, Barbados",308
7,"Ben Gurion Univ Negev, Beer Sheva, Israel",309
1,"Benaroya Res Inst Virginia Mason, Seattle, WA USA",310
1,"Bengbu Coll, Bengbu, Peoples R China",311
1,"Bentley Delivery Ctr, WA, Australia",312
1,"Berhampur Univ, Odisha, India",313
1,"Bermuda Inst Ocean Sci, St Georges, Bermuda",314
1,"Bernhard Nocht Inst Trop Med, Hamburg, Germany",315
17,"Bernice P Bishop Museum, Honolulu, HI USA",316
1,"Bernice Pauahi Bishop Museum, Honolulu, HI USA",317
1,"BFAR NFFTC, Nueva Ecija, Philippines",318
1,"BFAR NIFTDC, Dagupan City, Philippines",319
2,"BFAR, Quezon City, Philippines",320
1,"Bhagalpur Univ, Bihar, India",321
4,"Bharathiar Univ, Tamil Nadu, India",322
2,"Bharathidasan Univ, Tamil Nadu, India",323
1,"Bharathidasan Univ, Tiruchchirappalli, India",324
1,"BIARC, Qld, Australia",325
2,"Bicol Univ, Albay, Philippines",326
1,"Bicol Univ, Legazpi City, Philippines",327
1,"Bicol Univ, Tabaco City, Philippines",328
1,"Bigelow Lab Ocean Sci, W Boothbay Harbor, ME USA",329
1,"BIHS, Dhaka, Bangladesh",330
1,"Binangonan Freshwater Stn, Rizal, Philippines",331
1,"Binh Dinh Prov Hosp, Qui Nhon City, Vietnam",332
1,"Bio5 Inst Collaborat Biores, Tucson, AZ USA",333
1,"BioAccess Australia, Qld, Australia",334
1,"Biodivers Ctr, Singapore, Singapore",335
2,"Biodivers Project, Manado, Indonesia",336
1,"Biodivers Res & Training Program, Bangkok, Thailand",337
1,"Biodiversitat & Klima Forschungszentrum BiK F, Frankfurt, Germany",338
1,"Bioinformat Inst, Singapore, Singapore",339
2,"BIOL ANSTALT HELGOLAND, HAMBURG, GERMANY",340
1,"Biol Brigham Young Univ Hawaii, Laie, HI USA",341
2,"Biol Inst Kuroshio, Kochi, Japan",342
1,"Biol Resource Ctr, Chiba, Japan",343
1,"BIOL SCI CLUB, JAKARTA, INDONESIA",344
1,"BioMar Ltd, Grangemouth, Scotland",345
1,"Biomol Res Inst, Vic, Australia",346
1,"BioPol, Skagastrond, Iceland",347
1,"Biosecur Queensland Ecosci Precinct, Qld, Australia",348
1,"Biosecur Queensland, Qld, Australia",349
1,"BIOTEC Cent Res Unit, Pathum Thani, Thailand",350
1,"BIOTEC JGSEE Integrat Biorefinery Lab, Pathumthani, Thailand",351
3,"BIOTEC, Bangkok, Thailand",352
4,"BIOTEC, Pathum Thani, Thailand",353
3,"Biotec, PathumThani, Thailand",354
1,"Biotechnol Res Ctr, Kuala Lumpur, Malaysia",355
1,"BioTecnol BT Srl, Pantalla Di Todi PG, Italy",356
1,"BioTecnol BTSRL, Pantallia Di Todi PG, Italy",357
1,"Biovers Int France Off, Montpellier, France",358
1,"Biovers Int Headquarters, Maccarese Rome, Italy",359
1,"Biovers Int Reg Off Asia Pacific & Oceania, Selangor De, Malaysia",360
3,"Bishop Museum, Honolulu, HI USA",361
1,"Bishop Univ, Honolulu, HI USA",362
1,"Black Hills State Univ, Spearfish, SD USA",363
1,"Blackbeards Cruises, Davie, FL USA",364
1,"Blue Resources, Colombo, Sri Lanka",365
1,"BML Food Sci Solut, Tokyo, Japan",366
2,"Bodo Univ Coll, Bodo, Norway",367
1,"Boehringer GmbH, Mannheim, GERMANY",368
5,"Bogor Agr Univ IPB, Bogor, Indonesia",369
32,"Bogor Agr Univ, Bogor, Indonesia",370
1,"Bogor Agr Univ, Java, Indonesia",371
3,"Bogor Agr Univ, West Java, Indonesia",372
3,"Bogor Res Inst Estate Crops, Bogor, Indonesia",373
1,"BOKU Univ Nat Resources & Life Sci, Vienna, Austria",374
1,"Bookmark Inc, Manila, Philippines",375
1,"Borneo Plant Technol Sdn Bhd, Sarawak, Malaysia",376
1,"Boromarajonani Coll Nursing, Nonthaburi, Thailand",377
1,"Bose Inst, Kolkata, India",378
4,"Boston Univ, Boston, MA USA",379
1,"Bot Garden Inst FEB RAS, Vladivostok, Russia",380
1,"Bot Gardens Trust, NSW, Australia",381
1,"Bowling Green State Univ, Bowling Green, OH USA",382
1,"BPN RES CTR WARM WATER AQUACULTURE, SONGKHLA, THAILAND",383
1,"BPN, SONGKHLA, THAILAND",384
1,"BPPT, Jakarta, Indonesia",385
1,"BRAC, Dhaka, Bangladesh",386
1,"Brackishwater Aquaculture Dev Ctr Situbondo, Situbondo, Indonesia",387
1,"Brackishwater Aquaculture Dev Ctr, Central Java, Indonesia",388
1,"Brackishwater Aquaculture Dev Ctr, East Java, Indonesia",389
1,"Branch Off, Taichung, Taiwan",390
1,"Braunschweig Univ Technol, Braunschweig, Germany",391
2,"Brawijaya Univ, E Java, Indonesia",392
1,"Brawijaya Univ, East Java, Indonesia",393
5,"Brawijaya Univ, Malang, Indonesia",394
1,"BRBIH, Depok, Indonesia",395
1,"Breeding Program Sea Grant Oyster Hatchery, Grand Isle, LA USA",396
1,"Bribie Isl Aquaculture Res Ctr, Qld, Australia",397
4,"Brigham Young Univ, Provo, UT USA",398
1,"Bristol Myers Squibb Co, Princeton, NJ USA",399
9,"British Antarctic Survey, Cambridge, England",400
1,"British Columbia Canc Agcy, Vancouver BC, Canada",401
1,"British Embassy, Yangon, Myanmar",402
3,"British Geol Survey, Nottingham, England",403
1,"British Museum Nat Hist, London, England",404
1,"Broad Inst MIT & Harvard, Cambridge, MA USA",405
2,"Brock Univ, St Catharines ON, Canada",406
3,"Brown Univ, Providence, RI USA",407
1,"BRRI, Gazipur, Bangladesh",408
1,"Bruker Dalton KK, Kanagawa, Japan",409
1,"Brunswick Community Coll, Supply, NC USA",410
1,"Bu Alisina Univ, Hamadan, Iran",411
1,"Bubia Agr Res Ctr, Lae, Papua N Guinea",412
1,"Bucknell Univ, Lewisburg, PA USA",413
1,"Bulgarian Acad Sci, Sofia, Bulgaria",414
1,"Bumrungrad Hosp, Bangkok, Thailand",415
1,"Bundesforsch Anstalt Landwirtschaft FAL, Neustadt, Germany",416
1,"Bur Anim Ind, Quezon, Philippines",417
1,"Bur Biotechnol Anim Prod, Pathum Thani, Thailand",418
1,"Bur Fiseries & Aquat Resources, Nueva Ecija, Philippines",419
1,"Bur Fisheries & Aquat Resources Natl Freshwater F, Nueva Ecija, Philippines",420
1,"Bur Fisheries & Aquat Resources, Dagupan City, Philippines",421
1,"Bur Fisheries & Aquat Resources, Nueva Ecija, Philippines",422
1,"Bur Fisheries & Aquat Resources, Quezon City, Philippines",423
2,"Bur Fisheries & Aquat Resources, Quezon, Philippines",424
1,"Bur S China Sea Fisheries, Guangdong, Peoples R China",425
1,"Bur Sugar Expt Stn, Qld, Australia",426
1,"Burapa Univ, Chantaburi, Thailand",427
1,"Burapha Univ Bangsaen, Chon Buri, Thailand",428
2,"Burapha Univ Chanthaburi Campus, Chanthaburi, Thailand",429
2,"Burapha Univ, Bangsaen, Thailand",430
6,"Burapha Univ, Chanthaburi, Thailand",431
1,"Burapha Univ, Chon Buri Provi, Thailand",432
63,"Burapha Univ, Chon Buri, Thailand",433
1,"Burapha Univ, Chonburi Prov, Thailand",434
1,"Burapha Univ, Chonburi Provin, Thailand",435
43,"Burapha Univ, Chonburi, Thailand",436
1,"Burapha Univ, Chongburi, Thailand",437
1,"Burapha Univ, Muang Chonburi, Thailand",438
1,"Burapha Univ, Muang, Thailand",439
1,"Buraphar Univ, Chon Buri, Thailand",440
1,"Burgers Zoo, Arnhem, Indonesia",441
1,"Burgers Zoo, Arnhem, Netherlands",442
4,"Buriram Rajabhat Univ, Buriram, Thailand",443
1,"Bushehr Univ Med Sci, Bushehr, Iran",444
1,"BVBA Vose Consulting Belgium, Ghent, Belgium",445
1,"C Abdul Hakeem Coll, Melvisharam, India",446
2,"C Abdul Hakeem Coll, Tamil Nadu, India",447
1,"C3 Philippines & Micronesia Programme, Province Of Pal, Philippines",448
3,"CAAS, Gansu, Peoples R China",449
1,"CABI Biosci UK Egham, Surrey, England",450
1,"Cabrillo Coll, Aptos, CA USA",451
1,"Cairns Marine Aquarium Fish, Qld, Australia",452
2,"Cairo Univ, Cairo, Egypt",453
1,"Cairo Univ, Giza, Egypt",454
18,"Calif Acad Sci, San Francisco, CA USA",455
1,"Calif Dept Fish & Game, Ft Bragg, CA USA",456
1,"Calif Dept Food & Agr, Sacramento, CA USA",457
4,"Calif State Polytech Univ Pomona, Pomona, CA USA",458
3,"Calif State Univ Fresno, Fresno, CA USA",459
1,"Calif State Univ Long Beach, Long Beach, CA USA",460
1,"Calif State Univ Monterey Bay, Seaside, CA USA",461
1,"CALTECH, Pasadena, CA USA",462
1,"Calvin Coll, Grand Rapids, MI USA",463
1,"Cambodian Agr Res & Dev Inst, Phnom Penh, Cambodia",464
1,"Can Tho City, Can Tho City, Vietnam",465
13,"Can Tho Univ, Can Tho City, Vietnam",466
16,"Can Tho Univ, Can Tho, Vietnam",467
1,"Canadian Museum Nat, Ottawa ON, Canada",468
1,"Cantho Univ, Can Tho City, Vietnam",469
10,"Cantho Univ, Can Tho, Vietnam",470
13,"Cantho Univ, Cantho City, Vietnam",471
1,"Cantho Univ, Cantho, Vietnam",472
1,"Cardiff Univ, Cardiff CF1 3TL, Wales",473
1,"Cardiff Univ, Cardiff CF10 3AX, Wales",474
6,"Cardiff Univ, S Glam, Wales",475
1,"Cargill Siam Ltd, Bangkok, Thailand",476
1,"Cargill Texturizing Solut, Baupte, France",477
2,"Carl von Ossietzky Univ Oldenburg, Oldenburg, Germany",478
1,"Carl von Ossietzky Univ Oldenburg, Wilhelmshaven, Germany",479
3,"Carleton Univ, Ottawa ON, Canada",480
1,"Carnegie Mellon Univ, Pittsburgh, PA USA",481
1,"Carolina Vet Specialists, Huntersville, NC USA",482
2,"Case Western Reserve Univ, Cleveland, OH USA",483
1,"Caspian Sea Ecol Ctr, Sari, Iran",484
3,"Caspian Sea Ecol Res Ctr, Sari, Iran",485
1,"Caspian Sea Res Inst Ecol, Sari, Iran",486
1,"Catania Univ, Catania, Italy",487
2,"Catfish Asia Project, Jakarta, Indonesia",488
1,"Catholic Univ Korea, Puchon, South Korea",489
1,"Catholic Univ Leuven, Louvain, Belgium",490
1,"Catholic Univ Louvain, Brussels, Belgium",491
1,"Catholic Univ Louvain, Heverlee, Belgium",492
5,"Catholic Univ Louvain, Louvain, Belgium",493
5,"Cawthron Inst, Nelson, New Zealand",494
1,"CBGP, Dakar, Senegal",495
3,"CBS KNAW Fungal Biodivers Ctr, Utrecht, Netherlands",496
1,"CEA Saclay, Gif Sur Yvette, France",497
3,"CEA, Gif Sur Yvette, France",498
1,"CEAZA, Coquimbo, Chile",499
1,"Cefas Weymouth Lab, Dorset, England",500
2,"Cefas, Dorset, England",501
1,"CEFE CNRS, Montpellier, France",502
1,"Celal Bayar Univ, Muradiye Manisa, Turkey",503
1,"CEMAGREF, Montpellier, France",504
1,"Cent Agr Res Inst, Andaman & Nicob, India",505
1,"Cent Agr Univ, Tripura West, India",506
1,"Cent Asia Off, Kunming, Peoples R China",507
2,"Cent Bur Schimmelcultures, Utrecht, Netherlands",508
2,"Cent Drug Res Inst, Uttar Pradesh, India",509
1,"Cent Inland Fisheries Res Inst, W Bengal, India",510
5,"Cent Inst Brackishwater Aquaculture, Tamil Nadu, India",511
1,"Cent Inst Fisheries Educ, Maharashtra, India",512
1,"CENT INST FISHERIES EDUC, MUMBAI, INDIA",513
3,"Cent Inst Freshwater Aquaculture, Orissa, India",514
1,"Cent Inst Freshwater Aquaculture, W Bengal, India",515
1,"Cent Inst Med & Aromat Plants, Uttar Pradesh, India",516
1,"Cent Luzon State Univ FAC CLSU, Nueva Ecija, Philippines",517
1,"Cent Luzon State Univ Sci City Munoz, Nueva Ecija, Philippines",518
3,"Cent Luzon State Univ, Munoz, Philippines",519
20,"Cent Luzon State Univ, Nueva Ecija, Philippines",520
1,"Cent Luzon State Univ, Sci City Munoz, Philippines",521
1,"Cent Luzon State Univ, Sci City Of Munoz, Philippines",522
1,"Cent Marine Fisheries Res Inst CMFRI, Tamil Nadu, India",523
1,"Cent Marine Fisheries Res Inst KARWAR, Karnataka, India",524
1,"Cent Marine Fisheries Res Inst Reg Ctr, Andhra Pradesh, India",525
2,"Cent Marine Fisheries Res Inst Reg Ctr, Gujarat, India",526
1,"Cent Marine Fisheries Res Inst, Karnataka, India",527
6,"Cent Marine Fisheries Res Inst, Kerala, India",528
1,"Cent Michigan Univ, Mt Pleasant, MI USA",529
1,"Cent Pertiwi Bahari Ltd, Lampung Selatan, Indonesia",530
1,"Cent Queensland Univ, Qld, Australia",531
2,"Cent Res Inst Elect Power Ind, Chiba, Japan",532
1,"Cent Taiwan Univ Sci & Technol, Taichung, Taiwan",533
1,"Cent Vet Lab, Singapore, Singapore",534
1,"Cent Viet Nam Vet Inst, Nha Trang, Vietnam",535
